{
  "address": "0x4925f5B17e731C16bA4f33eeABd8fE23d683e95F",
  "abi": [
    {
      "inputs": [],
      "stateMutability": "nonpayable",
      "type": "constructor"
    },
    {
      "anonymous": false,
      "inputs": [
        {
          "indexed": false,
          "internalType": "address",
          "name": "prevFundDeployer",
          "type": "address"
        },
        {
          "indexed": false,
          "internalType": "address",
          "name": "nextFundDeployer",
          "type": "address"
        }
      ],
      "name": "CurrentFundDeployerSet",
      "type": "event"
    },
    {
      "anonymous": false,
      "inputs": [
        {
          "indexed": true,
          "internalType": "address",
          "name": "vaultProxy",
          "type": "address"
        },
        {
          "indexed": true,
          "internalType": "address",
          "name": "prevFundDeployer",
          "type": "address"
        },
        {
          "indexed": true,
          "internalType": "address",
          "name": "nextFundDeployer",
          "type": "address"
        },
        {
          "indexed": false,
          "internalType": "address",
          "name": "nextVaultAccessor",
          "type": "address"
        },
        {
          "indexed": false,
          "internalType": "address",
          "name": "nextVaultLib",
          "type": "address"
        },
        {
          "indexed": false,
          "internalType": "uint256",
          "name": "executableTimestamp",
          "type": "uint256"
        }
      ],
      "name": "MigrationCancelled",
      "type": "event"
    },
    {
      "anonymous": false,
      "inputs": [
        {
          "indexed": true,
          "internalType": "address",
          "name": "vaultProxy",
          "type": "address"
        },
        {
          "indexed": true,
          "internalType": "address",
          "name": "prevFundDeployer",
          "type": "address"
        },
        {
          "indexed": true,
          "internalType": "address",
          "name": "nextFundDeployer",
          "type": "address"
        },
        {
          "indexed": false,
          "internalType": "address",
          "name": "nextVaultAccessor",
          "type": "address"
        },
        {
          "indexed": false,
          "internalType": "address",
          "name": "nextVaultLib",
          "type": "address"
        },
        {
          "indexed": false,
          "internalType": "uint256",
          "name": "executableTimestamp",
          "type": "uint256"
        }
      ],
      "name": "MigrationExecuted",
      "type": "event"
    },
    {
      "anonymous": false,
      "inputs": [
        {
          "indexed": false,
          "internalType": "bytes",
          "name": "failureReturnData",
          "type": "bytes"
        },
        {
          "indexed": true,
          "internalType": "address",
          "name": "vaultProxy",
          "type": "address"
        },
        {
          "indexed": true,
          "internalType": "address",
          "name": "prevFundDeployer",
          "type": "address"
        },
        {
          "indexed": true,
          "internalType": "address",
          "name": "nextFundDeployer",
          "type": "address"
        },
        {
          "indexed": false,
          "internalType": "address",
          "name": "nextVaultAccessor",
          "type": "address"
        },
        {
          "indexed": false,
          "internalType": "address",
          "name": "nextVaultLib",
          "type": "address"
        }
      ],
      "name": "MigrationInCancelHookFailed",
      "type": "event"
    },
    {
      "anonymous": false,
      "inputs": [
        {
          "indexed": false,
          "internalType": "bytes",
          "name": "failureReturnData",
          "type": "bytes"
        },
        {
          "indexed": false,
          "internalType": "enum IMigrationHookHandler.MigrationOutHook",
          "name": "hook",
          "type": "uint8"
        },
        {
          "indexed": true,
          "internalType": "address",
          "name": "vaultProxy",
          "type": "address"
        },
        {
          "indexed": true,
          "internalType": "address",
          "name": "prevFundDeployer",
          "type": "address"
        },
        {
          "indexed": true,
          "internalType": "address",
          "name": "nextFundDeployer",
          "type": "address"
        },
        {
          "indexed": false,
          "internalType": "address",
          "name": "nextVaultAccessor",
          "type": "address"
        },
        {
          "indexed": false,
          "internalType": "address",
          "name": "nextVaultLib",
          "type": "address"
        }
      ],
      "name": "MigrationOutHookFailed",
      "type": "event"
    },
    {
      "anonymous": false,
      "inputs": [
        {
          "indexed": true,
          "internalType": "address",
          "name": "vaultProxy",
          "type": "address"
        },
        {
          "indexed": true,
          "internalType": "address",
          "name": "prevFundDeployer",
          "type": "address"
        },
        {
          "indexed": true,
          "internalType": "address",
          "name": "nextFundDeployer",
          "type": "address"
        },
        {
          "indexed": false,
          "internalType": "address",
          "name": "nextVaultAccessor",
          "type": "address"
        },
        {
          "indexed": false,
          "internalType": "address",
          "name": "nextVaultLib",
          "type": "address"
        },
        {
          "indexed": false,
          "internalType": "uint256",
          "name": "executableTimestamp",
          "type": "uint256"
        }
      ],
      "name": "MigrationSignaled",
      "type": "event"
    },
    {
      "anonymous": false,
      "inputs": [
        {
          "indexed": false,
          "internalType": "uint256",
          "name": "prevTimelock",
          "type": "uint256"
        },
        {
          "indexed": false,
          "internalType": "uint256",
          "name": "nextTimelock",
          "type": "uint256"
        }
      ],
      "name": "MigrationTimelockSet",
      "type": "event"
    },
    {
      "anonymous": false,
      "inputs": [
        {
          "indexed": true,
          "internalType": "address",
          "name": "nominatedOwner",
          "type": "address"
        }
      ],
      "name": "NominatedOwnerRemoved",
      "type": "event"
    },
    {
      "anonymous": false,
      "inputs": [
        {
          "indexed": true,
          "internalType": "address",
          "name": "nominatedOwner",
          "type": "address"
        }
      ],
      "name": "NominatedOwnerSet",
      "type": "event"
    },
    {
      "anonymous": false,
      "inputs": [
        {
          "indexed": true,
          "internalType": "address",
          "name": "prevOwner",
          "type": "address"
        },
        {
          "indexed": true,
          "internalType": "address",
          "name": "nextOwner",
          "type": "address"
        }
      ],
      "name": "OwnershipTransferred",
      "type": "event"
    },
    {
      "anonymous": false,
      "inputs": [
        {
          "indexed": false,
          "internalType": "string",
          "name": "_nextSymbol",
          "type": "string"
        }
      ],
      "name": "SharesTokenSymbolSet",
      "type": "event"
    },
    {
      "anonymous": false,
      "inputs": [
        {
          "indexed": true,
          "internalType": "address",
          "name": "fundDeployer",
          "type": "address"
        },
        {
          "indexed": true,
          "internalType": "address",
          "name": "owner",
          "type": "address"
        },
        {
          "indexed": false,
          "internalType": "address",
          "name": "vaultProxy",
          "type": "address"
        },
        {
          "indexed": true,
          "internalType": "address",
          "name": "vaultLib",
          "type": "address"
        },
        {
          "indexed": false,
          "internalType": "address",
          "name": "vaultAccessor",
          "type": "address"
        },
        {
          "indexed": false,
          "internalType": "string",
          "name": "fundName",
          "type": "string"
        }
      ],
      "name": "VaultProxyDeployed",
      "type": "event"
    },
    {
      "inputs": [
        {
          "internalType": "address",
          "name": "_vaultProxy",
          "type": "address"
        },
        {
          "internalType": "bool",
          "name": "_bypassFailure",
          "type": "bool"
        }
      ],
      "name": "cancelMigration",
      "outputs": [],
      "stateMutability": "nonpayable",
      "type": "function"
    },
    {
      "inputs": [],
      "name": "claimOwnership",
      "outputs": [],
      "stateMutability": "nonpayable",
      "type": "function"
    },
    {
      "inputs": [
        {
          "internalType": "address",
          "name": "_vaultLib",
          "type": "address"
        },
        {
          "internalType": "address",
          "name": "_owner",
          "type": "address"
        },
        {
          "internalType": "address",
          "name": "_vaultAccessor",
          "type": "address"
        },
        {
          "internalType": "string",
          "name": "_fundName",
          "type": "string"
        }
      ],
      "name": "deployVaultProxy",
      "outputs": [
        {
          "internalType": "address",
          "name": "vaultProxy_",
          "type": "address"
        }
      ],
      "stateMutability": "nonpayable",
      "type": "function"
    },
    {
      "inputs": [
        {
          "internalType": "address",
          "name": "_vaultProxy",
          "type": "address"
        },
        {
          "internalType": "bool",
          "name": "_bypassFailure",
          "type": "bool"
        }
      ],
      "name": "executeMigration",
      "outputs": [],
      "stateMutability": "nonpayable",
      "type": "function"
    },
    {
      "inputs": [],
      "name": "getCurrentFundDeployer",
      "outputs": [
        {
          "internalType": "address",
          "name": "currentFundDeployer_",
          "type": "address"
        }
      ],
      "stateMutability": "view",
      "type": "function"
    },
    {
      "inputs": [
        {
          "internalType": "address",
          "name": "_vaultProxy",
          "type": "address"
        }
      ],
      "name": "getFundDeployerForVaultProxy",
      "outputs": [
        {
          "internalType": "address",
          "name": "fundDeployer_",
          "type": "address"
        }
      ],
      "stateMutability": "view",
      "type": "function"
    },
    {
      "inputs": [
        {
          "internalType": "address",
          "name": "_vaultProxy",
          "type": "address"
        }
      ],
      "name": "getMigrationRequestDetailsForVaultProxy",
      "outputs": [
        {
          "internalType": "address",
          "name": "nextFundDeployer_",
          "type": "address"
        },
        {
          "internalType": "address",
          "name": "nextVaultAccessor_",
          "type": "address"
        },
        {
          "internalType": "address",
          "name": "nextVaultLib_",
          "type": "address"
        },
        {
          "internalType": "uint256",
          "name": "executableTimestamp_",
          "type": "uint256"
        }
      ],
      "stateMutability": "view",
      "type": "function"
    },
    {
      "inputs": [],
      "name": "getMigrationTimelock",
      "outputs": [
        {
          "internalType": "uint256",
          "name": "migrationTimelock_",
          "type": "uint256"
        }
      ],
      "stateMutability": "view",
      "type": "function"
    },
    {
      "inputs": [],
      "name": "getNominatedOwner",
      "outputs": [
        {
          "internalType": "address",
          "name": "nominatedOwner_",
          "type": "address"
        }
      ],
      "stateMutability": "view",
      "type": "function"
    },
    {
      "inputs": [],
      "name": "getOwner",
      "outputs": [
        {
          "internalType": "address",
          "name": "owner_",
          "type": "address"
        }
      ],
      "stateMutability": "view",
      "type": "function"
    },
    {
      "inputs": [],
      "name": "getSharesTokenSymbol",
      "outputs": [
        {
          "internalType": "string",
          "name": "sharesTokenSymbol_",
          "type": "string"
        }
      ],
      "stateMutability": "view",
      "type": "function"
    },
    {
      "inputs": [
        {
          "internalType": "address",
          "name": "_vaultProxy",
          "type": "address"
        }
      ],
      "name": "getTimelockRemainingForMigrationRequest",
      "outputs": [
        {
          "internalType": "uint256",
          "name": "secondsRemaining_",
          "type": "uint256"
        }
      ],
      "stateMutability": "view",
      "type": "function"
    },
    {
      "inputs": [
        {
          "internalType": "address",
          "name": "_vaultProxy",
          "type": "address"
        }
      ],
      "name": "hasExecutableMigrationRequest",
      "outputs": [
        {
          "internalType": "bool",
          "name": "hasExecutableRequest_",
          "type": "bool"
        }
      ],
      "stateMutability": "view",
      "type": "function"
    },
    {
      "inputs": [
        {
          "internalType": "address",
          "name": "_vaultProxy",
          "type": "address"
        }
      ],
      "name": "hasMigrationRequest",
      "outputs": [
        {
          "internalType": "bool",
          "name": "hasMigrationRequest_",
          "type": "bool"
        }
      ],
      "stateMutability": "view",
      "type": "function"
    },
    {
      "inputs": [],
      "name": "removeNominatedOwner",
      "outputs": [],
      "stateMutability": "nonpayable",
      "type": "function"
    },
    {
      "inputs": [
        {
          "internalType": "address",
          "name": "_nextFundDeployer",
          "type": "address"
        }
      ],
      "name": "setCurrentFundDeployer",
      "outputs": [],
      "stateMutability": "nonpayable",
      "type": "function"
    },
    {
      "inputs": [
        {
          "internalType": "uint256",
          "name": "_nextTimelock",
          "type": "uint256"
        }
      ],
      "name": "setMigrationTimelock",
      "outputs": [],
      "stateMutability": "nonpayable",
      "type": "function"
    },
    {
      "inputs": [
        {
          "internalType": "address",
          "name": "_nextNominatedOwner",
          "type": "address"
        }
      ],
      "name": "setNominatedOwner",
      "outputs": [],
      "stateMutability": "nonpayable",
      "type": "function"
    },
    {
      "inputs": [
        {
          "internalType": "string",
          "name": "_nextSymbol",
          "type": "string"
        }
      ],
      "name": "setSharesTokenSymbol",
      "outputs": [],
      "stateMutability": "nonpayable",
      "type": "function"
    },
    {
      "inputs": [
        {
          "internalType": "address",
          "name": "_vaultProxy",
          "type": "address"
        },
        {
          "internalType": "address",
          "name": "_nextVaultAccessor",
          "type": "address"
        },
        {
          "internalType": "address",
          "name": "_nextVaultLib",
          "type": "address"
        },
        {
          "internalType": "bool",
          "name": "_bypassFailure",
          "type": "bool"
        }
      ],
      "name": "signalMigration",
      "outputs": [],
      "stateMutability": "nonpayable",
      "type": "function"
    }
  ],
  "transactionHash": "0x39f0db979429e2bab134c57526dff5ba5f61447a95dd2f89c34e18b155e95172",
  "receipt": {
    "to": null,
    "from": "0xb10bcC8B508174c761CFB1E7143bFE37c4fBC3a1",
    "contractAddress": "0x4925f5B17e731C16bA4f33eeABd8fE23d683e95F",
    "transactionIndex": 0,
    "gasUsed": "2421479",
    "logsBloom": "0x00000000000000000000000000000000000000000000000000000000000000000000000000000000000000000000000000000000000000000000000000000000000000000000000000000000000000000000000000000000000000000000000000000000000000000000000000000000000000000000000000000000000000000000000000000000000000000000000000000000000000000000000000000000000000000000000000000000000000000000000000000000000000000000000000000000000000000000000000000000000000000000000000000000000000000000000000000000000000000000000000000000000000000000000000000000",
    "blockHash": "0x8525cf81f287afc39ebf4412812ff79e59e15ac40d8910c3473109c83dc06d73",
    "transactionHash": "0x39f0db979429e2bab134c57526dff5ba5f61447a95dd2f89c34e18b155e95172",
    "logs": [],
    "blockNumber": 27382069,
    "cumulativeGasUsed": "2421479",
    "status": 1,
    "byzantium": true
  },
  "args": [],
  "solcInputHash": "616bcd197648f809b4b4e612fb09cc9a",
  "metadata": "{\"compiler\":{\"version\":\"0.6.12+commit.27d51765\"},\"language\":\"Solidity\",\"output\":{\"abi\":[{\"inputs\":[],\"stateMutability\":\"nonpayable\",\"type\":\"constructor\"},{\"anonymous\":false,\"inputs\":[{\"indexed\":false,\"internalType\":\"address\",\"name\":\"prevFundDeployer\",\"type\":\"address\"},{\"indexed\":false,\"internalType\":\"address\",\"name\":\"nextFundDeployer\",\"type\":\"address\"}],\"name\":\"CurrentFundDeployerSet\",\"type\":\"event\"},{\"anonymous\":false,\"inputs\":[{\"indexed\":true,\"internalType\":\"address\",\"name\":\"vaultProxy\",\"type\":\"address\"},{\"indexed\":true,\"internalType\":\"address\",\"name\":\"prevFundDeployer\",\"type\":\"address\"},{\"indexed\":true,\"internalType\":\"address\",\"name\":\"nextFundDeployer\",\"type\":\"address\"},{\"indexed\":false,\"internalType\":\"address\",\"name\":\"nextVaultAccessor\",\"type\":\"address\"},{\"indexed\":false,\"internalType\":\"address\",\"name\":\"nextVaultLib\",\"type\":\"address\"},{\"indexed\":false,\"internalType\":\"uint256\",\"name\":\"executableTimestamp\",\"type\":\"uint256\"}],\"name\":\"MigrationCancelled\",\"type\":\"event\"},{\"anonymous\":false,\"inputs\":[{\"indexed\":true,\"internalType\":\"address\",\"name\":\"vaultProxy\",\"type\":\"address\"},{\"indexed\":true,\"internalType\":\"address\",\"name\":\"prevFundDeployer\",\"type\":\"address\"},{\"indexed\":true,\"internalType\":\"address\",\"name\":\"nextFundDeployer\",\"type\":\"address\"},{\"indexed\":false,\"internalType\":\"address\",\"name\":\"nextVaultAccessor\",\"type\":\"address\"},{\"indexed\":false,\"internalType\":\"address\",\"name\":\"nextVaultLib\",\"type\":\"address\"},{\"indexed\":false,\"internalType\":\"uint256\",\"name\":\"executableTimestamp\",\"type\":\"uint256\"}],\"name\":\"MigrationExecuted\",\"type\":\"event\"},{\"anonymous\":false,\"inputs\":[{\"indexed\":false,\"internalType\":\"bytes\",\"name\":\"failureReturnData\",\"type\":\"bytes\"},{\"indexed\":true,\"internalType\":\"address\",\"name\":\"vaultProxy\",\"type\":\"address\"},{\"indexed\":true,\"internalType\":\"address\",\"name\":\"prevFundDeployer\",\"type\":\"address\"},{\"indexed\":true,\"internalType\":\"address\",\"name\":\"nextFundDeployer\",\"type\":\"address\"},{\"indexed\":false,\"internalType\":\"address\",\"name\":\"nextVaultAccessor\",\"type\":\"address\"},{\"indexed\":false,\"internalType\":\"address\",\"name\":\"nextVaultLib\",\"type\":\"address\"}],\"name\":\"MigrationInCancelHookFailed\",\"type\":\"event\"},{\"anonymous\":false,\"inputs\":[{\"indexed\":false,\"internalType\":\"bytes\",\"name\":\"failureReturnData\",\"type\":\"bytes\"},{\"indexed\":false,\"internalType\":\"enum IMigrationHookHandler.MigrationOutHook\",\"name\":\"hook\",\"type\":\"uint8\"},{\"indexed\":true,\"internalType\":\"address\",\"name\":\"vaultProxy\",\"type\":\"address\"},{\"indexed\":true,\"internalType\":\"address\",\"name\":\"prevFundDeployer\",\"type\":\"address\"},{\"indexed\":true,\"internalType\":\"address\",\"name\":\"nextFundDeployer\",\"type\":\"address\"},{\"indexed\":false,\"internalType\":\"address\",\"name\":\"nextVaultAccessor\",\"type\":\"address\"},{\"indexed\":false,\"internalType\":\"address\",\"name\":\"nextVaultLib\",\"type\":\"address\"}],\"name\":\"MigrationOutHookFailed\",\"type\":\"event\"},{\"anonymous\":false,\"inputs\":[{\"indexed\":true,\"internalType\":\"address\",\"name\":\"vaultProxy\",\"type\":\"address\"},{\"indexed\":true,\"internalType\":\"address\",\"name\":\"prevFundDeployer\",\"type\":\"address\"},{\"indexed\":true,\"internalType\":\"address\",\"name\":\"nextFundDeployer\",\"type\":\"address\"},{\"indexed\":false,\"internalType\":\"address\",\"name\":\"nextVaultAccessor\",\"type\":\"address\"},{\"indexed\":false,\"internalType\":\"address\",\"name\":\"nextVaultLib\",\"type\":\"address\"},{\"indexed\":false,\"internalType\":\"uint256\",\"name\":\"executableTimestamp\",\"type\":\"uint256\"}],\"name\":\"MigrationSignaled\",\"type\":\"event\"},{\"anonymous\":false,\"inputs\":[{\"indexed\":false,\"internalType\":\"uint256\",\"name\":\"prevTimelock\",\"type\":\"uint256\"},{\"indexed\":false,\"internalType\":\"uint256\",\"name\":\"nextTimelock\",\"type\":\"uint256\"}],\"name\":\"MigrationTimelockSet\",\"type\":\"event\"},{\"anonymous\":false,\"inputs\":[{\"indexed\":true,\"internalType\":\"address\",\"name\":\"nominatedOwner\",\"type\":\"address\"}],\"name\":\"NominatedOwnerRemoved\",\"type\":\"event\"},{\"anonymous\":false,\"inputs\":[{\"indexed\":true,\"internalType\":\"address\",\"name\":\"nominatedOwner\",\"type\":\"address\"}],\"name\":\"NominatedOwnerSet\",\"type\":\"event\"},{\"anonymous\":false,\"inputs\":[{\"indexed\":true,\"internalType\":\"address\",\"name\":\"prevOwner\",\"type\":\"address\"},{\"indexed\":true,\"internalType\":\"address\",\"name\":\"nextOwner\",\"type\":\"address\"}],\"name\":\"OwnershipTransferred\",\"type\":\"event\"},{\"anonymous\":false,\"inputs\":[{\"indexed\":false,\"internalType\":\"string\",\"name\":\"_nextSymbol\",\"type\":\"string\"}],\"name\":\"SharesTokenSymbolSet\",\"type\":\"event\"},{\"anonymous\":false,\"inputs\":[{\"indexed\":true,\"internalType\":\"address\",\"name\":\"fundDeployer\",\"type\":\"address\"},{\"indexed\":true,\"internalType\":\"address\",\"name\":\"owner\",\"type\":\"address\"},{\"indexed\":false,\"internalType\":\"address\",\"name\":\"vaultProxy\",\"type\":\"address\"},{\"indexed\":true,\"internalType\":\"address\",\"name\":\"vaultLib\",\"type\":\"address\"},{\"indexed\":false,\"internalType\":\"address\",\"name\":\"vaultAccessor\",\"type\":\"address\"},{\"indexed\":false,\"internalType\":\"string\",\"name\":\"fundName\",\"type\":\"string\"}],\"name\":\"VaultProxyDeployed\",\"type\":\"event\"},{\"inputs\":[{\"internalType\":\"address\",\"name\":\"_vaultProxy\",\"type\":\"address\"},{\"internalType\":\"bool\",\"name\":\"_bypassFailure\",\"type\":\"bool\"}],\"name\":\"cancelMigration\",\"outputs\":[],\"stateMutability\":\"nonpayable\",\"type\":\"function\"},{\"inputs\":[],\"name\":\"claimOwnership\",\"outputs\":[],\"stateMutability\":\"nonpayable\",\"type\":\"function\"},{\"inputs\":[{\"internalType\":\"address\",\"name\":\"_vaultLib\",\"type\":\"address\"},{\"internalType\":\"address\",\"name\":\"_owner\",\"type\":\"address\"},{\"internalType\":\"address\",\"name\":\"_vaultAccessor\",\"type\":\"address\"},{\"internalType\":\"string\",\"name\":\"_fundName\",\"type\":\"string\"}],\"name\":\"deployVaultProxy\",\"outputs\":[{\"internalType\":\"address\",\"name\":\"vaultProxy_\",\"type\":\"address\"}],\"stateMutability\":\"nonpayable\",\"type\":\"function\"},{\"inputs\":[{\"internalType\":\"address\",\"name\":\"_vaultProxy\",\"type\":\"address\"},{\"internalType\":\"bool\",\"name\":\"_bypassFailure\",\"type\":\"bool\"}],\"name\":\"executeMigration\",\"outputs\":[],\"stateMutability\":\"nonpayable\",\"type\":\"function\"},{\"inputs\":[],\"name\":\"getCurrentFundDeployer\",\"outputs\":[{\"internalType\":\"address\",\"name\":\"currentFundDeployer_\",\"type\":\"address\"}],\"stateMutability\":\"view\",\"type\":\"function\"},{\"inputs\":[{\"internalType\":\"address\",\"name\":\"_vaultProxy\",\"type\":\"address\"}],\"name\":\"getFundDeployerForVaultProxy\",\"outputs\":[{\"internalType\":\"address\",\"name\":\"fundDeployer_\",\"type\":\"address\"}],\"stateMutability\":\"view\",\"type\":\"function\"},{\"inputs\":[{\"internalType\":\"address\",\"name\":\"_vaultProxy\",\"type\":\"address\"}],\"name\":\"getMigrationRequestDetailsForVaultProxy\",\"outputs\":[{\"internalType\":\"address\",\"name\":\"nextFundDeployer_\",\"type\":\"address\"},{\"internalType\":\"address\",\"name\":\"nextVaultAccessor_\",\"type\":\"address\"},{\"internalType\":\"address\",\"name\":\"nextVaultLib_\",\"type\":\"address\"},{\"internalType\":\"uint256\",\"name\":\"executableTimestamp_\",\"type\":\"uint256\"}],\"stateMutability\":\"view\",\"type\":\"function\"},{\"inputs\":[],\"name\":\"getMigrationTimelock\",\"outputs\":[{\"internalType\":\"uint256\",\"name\":\"migrationTimelock_\",\"type\":\"uint256\"}],\"stateMutability\":\"view\",\"type\":\"function\"},{\"inputs\":[],\"name\":\"getNominatedOwner\",\"outputs\":[{\"internalType\":\"address\",\"name\":\"nominatedOwner_\",\"type\":\"address\"}],\"stateMutability\":\"view\",\"type\":\"function\"},{\"inputs\":[],\"name\":\"getOwner\",\"outputs\":[{\"internalType\":\"address\",\"name\":\"owner_\",\"type\":\"address\"}],\"stateMutability\":\"view\",\"type\":\"function\"},{\"inputs\":[],\"name\":\"getSharesTokenSymbol\",\"outputs\":[{\"internalType\":\"string\",\"name\":\"sharesTokenSymbol_\",\"type\":\"string\"}],\"stateMutability\":\"view\",\"type\":\"function\"},{\"inputs\":[{\"internalType\":\"address\",\"name\":\"_vaultProxy\",\"type\":\"address\"}],\"name\":\"getTimelockRemainingForMigrationRequest\",\"outputs\":[{\"internalType\":\"uint256\",\"name\":\"secondsRemaining_\",\"type\":\"uint256\"}],\"stateMutability\":\"view\",\"type\":\"function\"},{\"inputs\":[{\"internalType\":\"address\",\"name\":\"_vaultProxy\",\"type\":\"address\"}],\"name\":\"hasExecutableMigrationRequest\",\"outputs\":[{\"internalType\":\"bool\",\"name\":\"hasExecutableRequest_\",\"type\":\"bool\"}],\"stateMutability\":\"view\",\"type\":\"function\"},{\"inputs\":[{\"internalType\":\"address\",\"name\":\"_vaultProxy\",\"type\":\"address\"}],\"name\":\"hasMigrationRequest\",\"outputs\":[{\"internalType\":\"bool\",\"name\":\"hasMigrationRequest_\",\"type\":\"bool\"}],\"stateMutability\":\"view\",\"type\":\"function\"},{\"inputs\":[],\"name\":\"removeNominatedOwner\",\"outputs\":[],\"stateMutability\":\"nonpayable\",\"type\":\"function\"},{\"inputs\":[{\"internalType\":\"address\",\"name\":\"_nextFundDeployer\",\"type\":\"address\"}],\"name\":\"setCurrentFundDeployer\",\"outputs\":[],\"stateMutability\":\"nonpayable\",\"type\":\"function\"},{\"inputs\":[{\"internalType\":\"uint256\",\"name\":\"_nextTimelock\",\"type\":\"uint256\"}],\"name\":\"setMigrationTimelock\",\"outputs\":[],\"stateMutability\":\"nonpayable\",\"type\":\"function\"},{\"inputs\":[{\"internalType\":\"address\",\"name\":\"_nextNominatedOwner\",\"type\":\"address\"}],\"name\":\"setNominatedOwner\",\"outputs\":[],\"stateMutability\":\"nonpayable\",\"type\":\"function\"},{\"inputs\":[{\"internalType\":\"string\",\"name\":\"_nextSymbol\",\"type\":\"string\"}],\"name\":\"setSharesTokenSymbol\",\"outputs\":[],\"stateMutability\":\"nonpayable\",\"type\":\"function\"},{\"inputs\":[{\"internalType\":\"address\",\"name\":\"_vaultProxy\",\"type\":\"address\"},{\"internalType\":\"address\",\"name\":\"_nextVaultAccessor\",\"type\":\"address\"},{\"internalType\":\"address\",\"name\":\"_nextVaultLib\",\"type\":\"address\"},{\"internalType\":\"bool\",\"name\":\"_bypassFailure\",\"type\":\"bool\"}],\"name\":\"signalMigration\",\"outputs\":[],\"stateMutability\":\"nonpayable\",\"type\":\"function\"}],\"devdoc\":{\"details\":\"DO NOT EDIT CONTRACT\",\"kind\":\"dev\",\"methods\":{\"cancelMigration(address,bool)\":{\"details\":\"Because this function must also be callable by a permissioned migrator, it has an extra migration hook to the nextFundDeployer for the case where cancelMigration() is called directly (rather than via the nextFundDeployer).\",\"params\":{\"_bypassFailure\":\"True if a failure in either migration hook should be ignored\",\"_vaultProxy\":\"The VaultProxy contract for which to cancel the migration request\"}},\"deployVaultProxy(address,address,address,string)\":{\"details\":\"Input validation should be handled by the VaultProxy during deployment\",\"params\":{\"_fundName\":\"The name of the fund\",\"_owner\":\"The account to set as the VaultProxy's owner\",\"_vaultAccessor\":\"The account to set as the VaultProxy's permissioned accessor\",\"_vaultLib\":\"The VaultLib library with which to instantiate the VaultProxy\"}},\"executeMigration(address,bool)\":{\"params\":{\"_bypassFailure\":\"True if a failure in either migration hook should be ignored\",\"_vaultProxy\":\"The VaultProxy contract for which to execute the migration request\"}},\"getCurrentFundDeployer()\":{\"returns\":{\"currentFundDeployer_\":\"The current FundDeployer contract address\"}},\"getFundDeployerForVaultProxy(address)\":{\"params\":{\"_vaultProxy\":\"The VaultProxy instance\"},\"returns\":{\"fundDeployer_\":\"The FundDeployer contract address\"}},\"getMigrationRequestDetailsForVaultProxy(address)\":{\"params\":{\"_vaultProxy\":\"The VaultProxy instance\"},\"returns\":{\"executableTimestamp_\":\"The timestamp at which the migration request can be executed\",\"nextFundDeployer_\":\"The FundDeployer contract address from which the migration request was made\",\"nextVaultAccessor_\":\"The account that will be the next `accessor` on the VaultProxy\",\"nextVaultLib_\":\"The next VaultLib library contract address to set on the VaultProxy\"}},\"getMigrationTimelock()\":{\"returns\":{\"migrationTimelock_\":\"The timelock value (in seconds)\"}},\"getNominatedOwner()\":{\"returns\":{\"nominatedOwner_\":\"The account that is nominated to be the owner\"}},\"getOwner()\":{\"returns\":{\"owner_\":\"The account that is the owner\"}},\"getSharesTokenSymbol()\":{\"returns\":{\"sharesTokenSymbol_\":\"The `symbol` value\"}},\"getTimelockRemainingForMigrationRequest(address)\":{\"params\":{\"_vaultProxy\":\"The VaultProxy instance\"},\"returns\":{\"secondsRemaining_\":\"The number of seconds remaining on the timelock\"}},\"hasExecutableMigrationRequest(address)\":{\"params\":{\"_vaultProxy\":\"The VaultProxy instance\"},\"returns\":{\"hasExecutableRequest_\":\"True if a migration request exists and is executable\"}},\"hasMigrationRequest(address)\":{\"params\":{\"_vaultProxy\":\"The VaultProxy instance\"},\"returns\":{\"hasMigrationRequest_\":\"True if a migration request exists\"}},\"setCurrentFundDeployer(address)\":{\"params\":{\"_nextFundDeployer\":\"The address of the FundDeployer contract\"}},\"setMigrationTimelock(uint256)\":{\"params\":{\"_nextTimelock\":\"The number of seconds for the new timelock\"}},\"setNominatedOwner(address)\":{\"details\":\"Does not prohibit overwriting the current nominatedOwner\",\"params\":{\"_nextNominatedOwner\":\"The account to nominate\"}},\"setSharesTokenSymbol(string)\":{\"params\":{\"_nextSymbol\":\"The symbol value to set\"}},\"signalMigration(address,address,address,bool)\":{\"params\":{\"_bypassFailure\":\"True if a failure in either migration hook should be ignored\",\"_nextVaultAccessor\":\"The account that will be the next `accessor` on the VaultProxy\",\"_nextVaultLib\":\"The next VaultLib library contract address to set on the VaultProxy\",\"_vaultProxy\":\"The VaultProxy contract for which to signal migration\"}}},\"title\":\"Dispatcher Contract\",\"version\":1},\"userdoc\":{\"kind\":\"user\",\"methods\":{\"cancelMigration(address,bool)\":{\"notice\":\"Cancels a pending migration request\"},\"claimOwnership()\":{\"notice\":\"Claim ownership of the contract\"},\"deployVaultProxy(address,address,address,string)\":{\"notice\":\"Deploys a VaultProxy\"},\"executeMigration(address,bool)\":{\"notice\":\"Executes a pending migration request\"},\"getCurrentFundDeployer()\":{\"notice\":\"Gets the current FundDeployer that is allowed to deploy and migrate funds\"},\"getFundDeployerForVaultProxy(address)\":{\"notice\":\"Gets the FundDeployer with which a given VaultProxy is associated\"},\"getMigrationRequestDetailsForVaultProxy(address)\":{\"notice\":\"Gets the details of a pending migration request for a given VaultProxy\"},\"getMigrationTimelock()\":{\"notice\":\"Gets the amount of time that must pass between signaling and executing a migration\"},\"getNominatedOwner()\":{\"notice\":\"Gets the account that is nominated to be the next owner of this contract\"},\"getOwner()\":{\"notice\":\"Gets the owner of this contract\"},\"getSharesTokenSymbol()\":{\"notice\":\"Gets the shares token `symbol` value for use in VaultProxy instances\"},\"getTimelockRemainingForMigrationRequest(address)\":{\"notice\":\"Gets the time remaining until the migration request of a given VaultProxy can be executed\"},\"hasExecutableMigrationRequest(address)\":{\"notice\":\"Checks whether a migration request that is executable exists for a given VaultProxy\"},\"hasMigrationRequest(address)\":{\"notice\":\"Checks whether a migration request exists for a given VaultProxy\"},\"removeNominatedOwner()\":{\"notice\":\"Revoke the nomination of a new contract owner\"},\"setCurrentFundDeployer(address)\":{\"notice\":\"Set a new FundDeployer for use within the contract\"},\"setMigrationTimelock(uint256)\":{\"notice\":\"Sets a new migration timelock\"},\"setNominatedOwner(address)\":{\"notice\":\"Nominate a new contract owner\"},\"setSharesTokenSymbol(string)\":{\"notice\":\"Sets a new `symbol` value for VaultProxy instances\"},\"signalMigration(address,address,address,bool)\":{\"notice\":\"Signals a migration by creating a migration request\"}},\"notice\":\"The top-level contract linking multiple releases. It handles the deployment of new VaultProxy instances, and the regulation of fund migration from a previous release to the current one. It can also be referred to for access-control based on this contract's owner.\",\"version\":1}},\"settings\":{\"compilationTarget\":{\"contracts/persistent/dispatcher/Dispatcher.sol\":\"Dispatcher\"},\"evmVersion\":\"istanbul\",\"libraries\":{},\"metadata\":{\"bytecodeHash\":\"ipfs\",\"useLiteralContent\":true},\"optimizer\":{\"details\":{\"constantOptimizer\":true,\"cse\":true,\"deduplicate\":true,\"jumpdestRemover\":true,\"orderLiterals\":true,\"peephole\":true,\"yul\":false},\"runs\":200},\"remappings\":[]},\"sources\":{\"contracts/persistent/dispatcher/Dispatcher.sol\":{\"content\":\"// SPDX-License-Identifier: GPL-3.0\\r\\n\\r\\n\\r\\n\\r\\npragma solidity 0.6.12;\\r\\n\\r\\nimport \\\"../utils/IMigrationHookHandler.sol\\\";\\r\\nimport \\\"../utils/IMigratableVault.sol\\\";\\r\\nimport \\\"../vault/VaultProxy.sol\\\";\\r\\nimport \\\"./IDispatcher.sol\\\";\\r\\n\\r\\n/// @title Dispatcher Contract\\r\\n/// @notice The top-level contract linking multiple releases.\\r\\n/// It handles the deployment of new VaultProxy instances,\\r\\n/// and the regulation of fund migration from a previous release to the current one.\\r\\n/// It can also be referred to for access-control based on this contract's owner.\\r\\n/// @dev DO NOT EDIT CONTRACT\\r\\ncontract Dispatcher is IDispatcher {\\r\\n    event CurrentFundDeployerSet(address prevFundDeployer, address nextFundDeployer);\\r\\n\\r\\n    event MigrationCancelled(\\r\\n        address indexed vaultProxy,\\r\\n        address indexed prevFundDeployer,\\r\\n        address indexed nextFundDeployer,\\r\\n        address nextVaultAccessor,\\r\\n        address nextVaultLib,\\r\\n        uint256 executableTimestamp\\r\\n    );\\r\\n\\r\\n    event MigrationExecuted(\\r\\n        address indexed vaultProxy,\\r\\n        address indexed prevFundDeployer,\\r\\n        address indexed nextFundDeployer,\\r\\n        address nextVaultAccessor,\\r\\n        address nextVaultLib,\\r\\n        uint256 executableTimestamp\\r\\n    );\\r\\n\\r\\n    event MigrationSignaled(\\r\\n        address indexed vaultProxy,\\r\\n        address indexed prevFundDeployer,\\r\\n        address indexed nextFundDeployer,\\r\\n        address nextVaultAccessor,\\r\\n        address nextVaultLib,\\r\\n        uint256 executableTimestamp\\r\\n    );\\r\\n\\r\\n    event MigrationTimelockSet(uint256 prevTimelock, uint256 nextTimelock);\\r\\n\\r\\n    event NominatedOwnerSet(address indexed nominatedOwner);\\r\\n\\r\\n    event NominatedOwnerRemoved(address indexed nominatedOwner);\\r\\n\\r\\n    event OwnershipTransferred(address indexed prevOwner, address indexed nextOwner);\\r\\n\\r\\n    event MigrationInCancelHookFailed(\\r\\n        bytes failureReturnData,\\r\\n        address indexed vaultProxy,\\r\\n        address indexed prevFundDeployer,\\r\\n        address indexed nextFundDeployer,\\r\\n        address nextVaultAccessor,\\r\\n        address nextVaultLib\\r\\n    );\\r\\n\\r\\n    event MigrationOutHookFailed(\\r\\n        bytes failureReturnData,\\r\\n        IMigrationHookHandler.MigrationOutHook hook,\\r\\n        address indexed vaultProxy,\\r\\n        address indexed prevFundDeployer,\\r\\n        address indexed nextFundDeployer,\\r\\n        address nextVaultAccessor,\\r\\n        address nextVaultLib\\r\\n    );\\r\\n\\r\\n    event SharesTokenSymbolSet(string _nextSymbol);\\r\\n\\r\\n    event VaultProxyDeployed(\\r\\n        address indexed fundDeployer,\\r\\n        address indexed owner,\\r\\n        address vaultProxy,\\r\\n        address indexed vaultLib,\\r\\n        address vaultAccessor,\\r\\n        string fundName\\r\\n    );\\r\\n\\r\\n    struct MigrationRequest {\\r\\n        address nextFundDeployer;\\r\\n        address nextVaultAccessor;\\r\\n        address nextVaultLib;\\r\\n        uint256 executableTimestamp;\\r\\n    }\\r\\n\\r\\n    address private currentFundDeployer;\\r\\n    address private nominatedOwner;\\r\\n    address private owner;\\r\\n    uint256 private migrationTimelock;\\r\\n    string private sharesTokenSymbol;\\r\\n    mapping(address => address) private vaultProxyToFundDeployer;\\r\\n    mapping(address => MigrationRequest) private vaultProxyToMigrationRequest;\\r\\n\\r\\n    modifier onlyCurrentFundDeployer() {\\r\\n        require(\\r\\n            msg.sender == currentFundDeployer,\\r\\n            \\\"Only the current FundDeployer can call this function\\\"\\r\\n        );\\r\\n        _;\\r\\n    }\\r\\n\\r\\n    modifier onlyOwner() {\\r\\n        require(msg.sender == owner, \\\"Only the contract owner can call this function\\\");\\r\\n        _;\\r\\n    }\\r\\n\\r\\n    constructor() public {\\r\\n        migrationTimelock = 2 days;\\r\\n        owner = msg.sender;\\r\\n        sharesTokenSymbol = \\\"TAODAO\\\";\\r\\n    }\\r\\n\\r\\n    /////////////\\r\\n    // GENERAL //\\r\\n    /////////////\\r\\n\\r\\n    /// @notice Sets a new `symbol` value for VaultProxy instances\\r\\n    /// @param _nextSymbol The symbol value to set\\r\\n    function setSharesTokenSymbol(string calldata _nextSymbol) external override onlyOwner {\\r\\n        sharesTokenSymbol = _nextSymbol;\\r\\n\\r\\n        emit SharesTokenSymbolSet(_nextSymbol);\\r\\n    }\\r\\n\\r\\n    ////////////////////\\r\\n    // ACCESS CONTROL //\\r\\n    ////////////////////\\r\\n\\r\\n    /// @notice Claim ownership of the contract\\r\\n    function claimOwnership() external override {\\r\\n        address nextOwner = nominatedOwner;\\r\\n        require(\\r\\n            msg.sender == nextOwner,\\r\\n            \\\"claimOwnership: Only the nominatedOwner can call this function\\\"\\r\\n        );\\r\\n\\r\\n        delete nominatedOwner;\\r\\n\\r\\n        address prevOwner = owner;\\r\\n        owner = nextOwner;\\r\\n\\r\\n        emit OwnershipTransferred(prevOwner, nextOwner);\\r\\n    }\\r\\n\\r\\n    /// @notice Revoke the nomination of a new contract owner\\r\\n    function removeNominatedOwner() external override onlyOwner {\\r\\n        address removedNominatedOwner = nominatedOwner;\\r\\n        require(\\r\\n            removedNominatedOwner != address(0),\\r\\n            \\\"removeNominatedOwner: There is no nominated owner\\\"\\r\\n        );\\r\\n\\r\\n        delete nominatedOwner;\\r\\n\\r\\n        emit NominatedOwnerRemoved(removedNominatedOwner);\\r\\n    }\\r\\n\\r\\n    /// @notice Set a new FundDeployer for use within the contract\\r\\n    /// @param _nextFundDeployer The address of the FundDeployer contract\\r\\n    function setCurrentFundDeployer(address _nextFundDeployer) external override onlyOwner {\\r\\n        require(\\r\\n            _nextFundDeployer != address(0),\\r\\n            \\\"setCurrentFundDeployer: _nextFundDeployer cannot be empty\\\"\\r\\n        );\\r\\n        require(\\r\\n            __isContract(_nextFundDeployer),\\r\\n            \\\"setCurrentFundDeployer: Non-contract _nextFundDeployer\\\"\\r\\n        );\\r\\n\\r\\n        address prevFundDeployer = currentFundDeployer;\\r\\n        require(\\r\\n            _nextFundDeployer != prevFundDeployer,\\r\\n            \\\"setCurrentFundDeployer: _nextFundDeployer is already currentFundDeployer\\\"\\r\\n        );\\r\\n\\r\\n        currentFundDeployer = _nextFundDeployer;\\r\\n\\r\\n        emit CurrentFundDeployerSet(prevFundDeployer, _nextFundDeployer);\\r\\n    }\\r\\n\\r\\n    /// @notice Nominate a new contract owner\\r\\n    /// @param _nextNominatedOwner The account to nominate\\r\\n    /// @dev Does not prohibit overwriting the current nominatedOwner\\r\\n    function setNominatedOwner(address _nextNominatedOwner) external override onlyOwner {\\r\\n        require(\\r\\n            _nextNominatedOwner != address(0),\\r\\n            \\\"setNominatedOwner: _nextNominatedOwner cannot be empty\\\"\\r\\n        );\\r\\n        require(\\r\\n            _nextNominatedOwner != owner,\\r\\n            \\\"setNominatedOwner: _nextNominatedOwner is already the owner\\\"\\r\\n        );\\r\\n        require(\\r\\n            _nextNominatedOwner != nominatedOwner,\\r\\n            \\\"setNominatedOwner: _nextNominatedOwner is already nominated\\\"\\r\\n        );\\r\\n\\r\\n        nominatedOwner = _nextNominatedOwner;\\r\\n\\r\\n        emit NominatedOwnerSet(_nextNominatedOwner);\\r\\n    }\\r\\n\\r\\n    /// @dev Helper to check whether an address is a deployed contract\\r\\n    function __isContract(address _who) private view returns (bool isContract_) {\\r\\n        uint256 size;\\r\\n        assembly {\\r\\n            size := extcodesize(_who)\\r\\n        }\\r\\n\\r\\n        return size > 0;\\r\\n    }\\r\\n\\r\\n    ////////////////\\r\\n    // DEPLOYMENT //\\r\\n    ////////////////\\r\\n\\r\\n    /// @notice Deploys a VaultProxy\\r\\n    /// @param _vaultLib The VaultLib library with which to instantiate the VaultProxy\\r\\n    /// @param _owner The account to set as the VaultProxy's owner\\r\\n    /// @param _vaultAccessor The account to set as the VaultProxy's permissioned accessor\\r\\n    /// @param _fundName The name of the fund\\r\\n    /// @dev Input validation should be handled by the VaultProxy during deployment\\r\\n    function deployVaultProxy(\\r\\n        address _vaultLib,\\r\\n        address _owner,\\r\\n        address _vaultAccessor,\\r\\n        string calldata _fundName\\r\\n    ) external override onlyCurrentFundDeployer returns (address vaultProxy_) {\\r\\n        require(__isContract(_vaultAccessor), \\\"deployVaultProxy: Non-contract _vaultAccessor\\\");\\r\\n\\r\\n        bytes memory constructData = abi.encodeWithSelector(\\r\\n            IMigratableVault.init.selector,\\r\\n            _owner,\\r\\n            _vaultAccessor,\\r\\n            _fundName\\r\\n        );\\r\\n        vaultProxy_ = address(new VaultProxy(constructData, _vaultLib));\\r\\n\\r\\n        address fundDeployer = msg.sender;\\r\\n        vaultProxyToFundDeployer[vaultProxy_] = fundDeployer;\\r\\n\\r\\n        emit VaultProxyDeployed(\\r\\n            fundDeployer,\\r\\n            _owner,\\r\\n            vaultProxy_,\\r\\n            _vaultLib,\\r\\n            _vaultAccessor,\\r\\n            _fundName\\r\\n        );\\r\\n\\r\\n        return vaultProxy_;\\r\\n    }\\r\\n\\r\\n    ////////////////\\r\\n    // MIGRATIONS //\\r\\n    ////////////////\\r\\n\\r\\n    /// @notice Cancels a pending migration request\\r\\n    /// @param _vaultProxy The VaultProxy contract for which to cancel the migration request\\r\\n    /// @param _bypassFailure True if a failure in either migration hook should be ignored\\r\\n    /// @dev Because this function must also be callable by a permissioned migrator, it has an\\r\\n    /// extra migration hook to the nextFundDeployer for the case where cancelMigration()\\r\\n    /// is called directly (rather than via the nextFundDeployer).\\r\\n    function cancelMigration(address _vaultProxy, bool _bypassFailure) external override {\\r\\n        MigrationRequest memory request = vaultProxyToMigrationRequest[_vaultProxy];\\r\\n        address nextFundDeployer = request.nextFundDeployer;\\r\\n        require(nextFundDeployer != address(0), \\\"cancelMigration: No migration request exists\\\");\\r\\n\\r\\n        // TODO: confirm that if canMigrate() does not exist but the caller is a valid FundDeployer, this still works.\\r\\n        require(\\r\\n            msg.sender == nextFundDeployer || IMigratableVault(_vaultProxy).canMigrate(msg.sender),\\r\\n            \\\"cancelMigration: Not an allowed caller\\\"\\r\\n        );\\r\\n\\r\\n        address prevFundDeployer = vaultProxyToFundDeployer[_vaultProxy];\\r\\n        address nextVaultAccessor = request.nextVaultAccessor;\\r\\n        address nextVaultLib = request.nextVaultLib;\\r\\n        uint256 executableTimestamp = request.executableTimestamp;\\r\\n\\r\\n        delete vaultProxyToMigrationRequest[_vaultProxy];\\r\\n\\r\\n        __invokeMigrationOutHook(\\r\\n            IMigrationHookHandler.MigrationOutHook.PostCancel,\\r\\n            _vaultProxy,\\r\\n            prevFundDeployer,\\r\\n            nextFundDeployer,\\r\\n            nextVaultAccessor,\\r\\n            nextVaultLib,\\r\\n            _bypassFailure\\r\\n        );\\r\\n        __invokeMigrationInCancelHook(\\r\\n            _vaultProxy,\\r\\n            prevFundDeployer,\\r\\n            nextFundDeployer,\\r\\n            nextVaultAccessor,\\r\\n            nextVaultLib,\\r\\n            _bypassFailure\\r\\n        );\\r\\n\\r\\n        emit MigrationCancelled(\\r\\n            _vaultProxy,\\r\\n            prevFundDeployer,\\r\\n            nextFundDeployer,\\r\\n            nextVaultAccessor,\\r\\n            nextVaultLib,\\r\\n            executableTimestamp\\r\\n        );\\r\\n    }\\r\\n\\r\\n    /// @notice Executes a pending migration request\\r\\n    /// @param _vaultProxy The VaultProxy contract for which to execute the migration request\\r\\n    /// @param _bypassFailure True if a failure in either migration hook should be ignored\\r\\n    function executeMigration(address _vaultProxy, bool _bypassFailure) external override {\\r\\n        MigrationRequest memory request = vaultProxyToMigrationRequest[_vaultProxy];\\r\\n        address nextFundDeployer = request.nextFundDeployer;\\r\\n        require(\\r\\n            nextFundDeployer != address(0),\\r\\n            \\\"executeMigration: No migration request exists for _vaultProxy\\\"\\r\\n        );\\r\\n        require(\\r\\n            msg.sender == nextFundDeployer,\\r\\n            \\\"executeMigration: Only the target FundDeployer can call this function\\\"\\r\\n        );\\r\\n        require(\\r\\n            nextFundDeployer == currentFundDeployer,\\r\\n            \\\"executeMigration: The target FundDeployer is no longer the current FundDeployer\\\"\\r\\n        );\\r\\n        uint256 executableTimestamp = request.executableTimestamp;\\r\\n        require(\\r\\n            block.timestamp >= executableTimestamp,\\r\\n            \\\"executeMigration: The migration timelock has not elapsed\\\"\\r\\n        );\\r\\n\\r\\n        address prevFundDeployer = vaultProxyToFundDeployer[_vaultProxy];\\r\\n        address nextVaultAccessor = request.nextVaultAccessor;\\r\\n        address nextVaultLib = request.nextVaultLib;\\r\\n\\r\\n        __invokeMigrationOutHook(\\r\\n            IMigrationHookHandler.MigrationOutHook.PreMigrate,\\r\\n            _vaultProxy,\\r\\n            prevFundDeployer,\\r\\n            nextFundDeployer,\\r\\n            nextVaultAccessor,\\r\\n            nextVaultLib,\\r\\n            _bypassFailure\\r\\n        );\\r\\n\\r\\n        // Upgrade the VaultProxy to a new VaultLib and update the accessor via the new VaultLib\\r\\n        IMigratableVault(_vaultProxy).setVaultLib(nextVaultLib);\\r\\n        IMigratableVault(_vaultProxy).setAccessor(nextVaultAccessor);\\r\\n\\r\\n        // Update the FundDeployer that migrated the VaultProxy\\r\\n        vaultProxyToFundDeployer[_vaultProxy] = nextFundDeployer;\\r\\n\\r\\n        // Remove the migration request\\r\\n        delete vaultProxyToMigrationRequest[_vaultProxy];\\r\\n\\r\\n        __invokeMigrationOutHook(\\r\\n            IMigrationHookHandler.MigrationOutHook.PostMigrate,\\r\\n            _vaultProxy,\\r\\n            prevFundDeployer,\\r\\n            nextFundDeployer,\\r\\n            nextVaultAccessor,\\r\\n            nextVaultLib,\\r\\n            _bypassFailure\\r\\n        );\\r\\n\\r\\n        emit MigrationExecuted(\\r\\n            _vaultProxy,\\r\\n            prevFundDeployer,\\r\\n            nextFundDeployer,\\r\\n            nextVaultAccessor,\\r\\n            nextVaultLib,\\r\\n            executableTimestamp\\r\\n        );\\r\\n    }\\r\\n\\r\\n    /// @notice Sets a new migration timelock\\r\\n    /// @param _nextTimelock The number of seconds for the new timelock\\r\\n    function setMigrationTimelock(uint256 _nextTimelock) external override onlyOwner {\\r\\n        uint256 prevTimelock = migrationTimelock;\\r\\n        require(\\r\\n            _nextTimelock != prevTimelock,\\r\\n            \\\"setMigrationTimelock: _nextTimelock is the current timelock\\\"\\r\\n        );\\r\\n\\r\\n        migrationTimelock = _nextTimelock;\\r\\n\\r\\n        emit MigrationTimelockSet(prevTimelock, _nextTimelock);\\r\\n    }\\r\\n\\r\\n    /// @notice Signals a migration by creating a migration request\\r\\n    /// @param _vaultProxy The VaultProxy contract for which to signal migration\\r\\n    /// @param _nextVaultAccessor The account that will be the next `accessor` on the VaultProxy\\r\\n    /// @param _nextVaultLib The next VaultLib library contract address to set on the VaultProxy\\r\\n    /// @param _bypassFailure True if a failure in either migration hook should be ignored\\r\\n    function signalMigration(\\r\\n        address _vaultProxy,\\r\\n        address _nextVaultAccessor,\\r\\n        address _nextVaultLib,\\r\\n        bool _bypassFailure\\r\\n    ) external override onlyCurrentFundDeployer {\\r\\n        require(\\r\\n            __isContract(_nextVaultAccessor),\\r\\n            \\\"signalMigration: Non-contract _nextVaultAccessor\\\"\\r\\n        );\\r\\n\\r\\n        address prevFundDeployer = vaultProxyToFundDeployer[_vaultProxy];\\r\\n        require(prevFundDeployer != address(0), \\\"signalMigration: _vaultProxy does not exist\\\");\\r\\n\\r\\n        address nextFundDeployer = msg.sender;\\r\\n        require(\\r\\n            nextFundDeployer != prevFundDeployer,\\r\\n            \\\"signalMigration: Can only migrate to a new FundDeployer\\\"\\r\\n        );\\r\\n\\r\\n        __invokeMigrationOutHook(\\r\\n            IMigrationHookHandler.MigrationOutHook.PreSignal,\\r\\n            _vaultProxy,\\r\\n            prevFundDeployer,\\r\\n            nextFundDeployer,\\r\\n            _nextVaultAccessor,\\r\\n            _nextVaultLib,\\r\\n            _bypassFailure\\r\\n        );\\r\\n\\r\\n        uint256 executableTimestamp = block.timestamp + migrationTimelock;\\r\\n        vaultProxyToMigrationRequest[_vaultProxy] = MigrationRequest({\\r\\n            nextFundDeployer: nextFundDeployer,\\r\\n            nextVaultAccessor: _nextVaultAccessor,\\r\\n            nextVaultLib: _nextVaultLib,\\r\\n            executableTimestamp: executableTimestamp\\r\\n        });\\r\\n\\r\\n        __invokeMigrationOutHook(\\r\\n            IMigrationHookHandler.MigrationOutHook.PostSignal,\\r\\n            _vaultProxy,\\r\\n            prevFundDeployer,\\r\\n            nextFundDeployer,\\r\\n            _nextVaultAccessor,\\r\\n            _nextVaultLib,\\r\\n            _bypassFailure\\r\\n        );\\r\\n\\r\\n        emit MigrationSignaled(\\r\\n            _vaultProxy,\\r\\n            prevFundDeployer,\\r\\n            nextFundDeployer,\\r\\n            _nextVaultAccessor,\\r\\n            _nextVaultLib,\\r\\n            executableTimestamp\\r\\n        );\\r\\n    }\\r\\n\\r\\n    /// @dev Helper to invoke a MigrationInCancelHook on the next FundDeployer being \\\"migrated in\\\" to,\\r\\n    /// which can optionally be implemented on the FundDeployer\\r\\n    function __invokeMigrationInCancelHook(\\r\\n        address _vaultProxy,\\r\\n        address _prevFundDeployer,\\r\\n        address _nextFundDeployer,\\r\\n        address _nextVaultAccessor,\\r\\n        address _nextVaultLib,\\r\\n        bool _bypassFailure\\r\\n    ) private {\\r\\n        (bool success, bytes memory returnData) = _nextFundDeployer.call(\\r\\n            abi.encodeWithSelector(\\r\\n                IMigrationHookHandler.invokeMigrationInCancelHook.selector,\\r\\n                _vaultProxy,\\r\\n                _prevFundDeployer,\\r\\n                _nextVaultAccessor,\\r\\n                _nextVaultLib\\r\\n            )\\r\\n        );\\r\\n        if (!success) {\\r\\n            require(\\r\\n                _bypassFailure,\\r\\n                string(abi.encodePacked(\\\"MigrationOutCancelHook: \\\", returnData))\\r\\n            );\\r\\n\\r\\n            emit MigrationInCancelHookFailed(\\r\\n                returnData,\\r\\n                _vaultProxy,\\r\\n                _prevFundDeployer,\\r\\n                _nextFundDeployer,\\r\\n                _nextVaultAccessor,\\r\\n                _nextVaultLib\\r\\n            );\\r\\n        }\\r\\n    }\\r\\n\\r\\n    /// @dev Helper to invoke a IMigrationHookHandler.MigrationOutHook on the previous FundDeployer being \\\"migrated out\\\" of,\\r\\n    /// which can optionally be implemented on the FundDeployer\\r\\n    function __invokeMigrationOutHook(\\r\\n        IMigrationHookHandler.MigrationOutHook _hook,\\r\\n        address _vaultProxy,\\r\\n        address _prevFundDeployer,\\r\\n        address _nextFundDeployer,\\r\\n        address _nextVaultAccessor,\\r\\n        address _nextVaultLib,\\r\\n        bool _bypassFailure\\r\\n    ) private {\\r\\n        (bool success, bytes memory returnData) = _prevFundDeployer.call(\\r\\n            abi.encodeWithSelector(\\r\\n                IMigrationHookHandler.invokeMigrationOutHook.selector,\\r\\n                _hook,\\r\\n                _vaultProxy,\\r\\n                _nextFundDeployer,\\r\\n                _nextVaultAccessor,\\r\\n                _nextVaultLib\\r\\n            )\\r\\n        );\\r\\n        if (!success) {\\r\\n            require(\\r\\n                _bypassFailure,\\r\\n                string(abi.encodePacked(__migrationOutHookFailureReasonPrefix(_hook), returnData))\\r\\n            );\\r\\n\\r\\n            emit MigrationOutHookFailed(\\r\\n                returnData,\\r\\n                _hook,\\r\\n                _vaultProxy,\\r\\n                _prevFundDeployer,\\r\\n                _nextFundDeployer,\\r\\n                _nextVaultAccessor,\\r\\n                _nextVaultLib\\r\\n            );\\r\\n        }\\r\\n    }\\r\\n\\r\\n    /// @dev Helper to return a revert reason string prefix for a given MigrationOutHook\\r\\n    function __migrationOutHookFailureReasonPrefix(IMigrationHookHandler.MigrationOutHook _hook)\\r\\n        private\\r\\n        pure\\r\\n        returns (string memory failureReasonPrefix_)\\r\\n    {\\r\\n        if (_hook == IMigrationHookHandler.MigrationOutHook.PreSignal) {\\r\\n            return \\\"MigrationOutHook.PreSignal: \\\";\\r\\n        }\\r\\n        if (_hook == IMigrationHookHandler.MigrationOutHook.PostSignal) {\\r\\n            return \\\"MigrationOutHook.PostSignal: \\\";\\r\\n        }\\r\\n        if (_hook == IMigrationHookHandler.MigrationOutHook.PreMigrate) {\\r\\n            return \\\"MigrationOutHook.PreMigrate: \\\";\\r\\n        }\\r\\n        if (_hook == IMigrationHookHandler.MigrationOutHook.PostMigrate) {\\r\\n            return \\\"MigrationOutHook.PostMigrate: \\\";\\r\\n        }\\r\\n        if (_hook == IMigrationHookHandler.MigrationOutHook.PostCancel) {\\r\\n            return \\\"MigrationOutHook.PostCancel: \\\";\\r\\n        }\\r\\n\\r\\n        return \\\"\\\";\\r\\n    }\\r\\n\\r\\n    ///////////////////\\r\\n    // STATE GETTERS //\\r\\n    ///////////////////\\r\\n\\r\\n    // Provides several potentially helpful getters that are not strictly necessary\\r\\n\\r\\n    /// @notice Gets the current FundDeployer that is allowed to deploy and migrate funds\\r\\n    /// @return currentFundDeployer_ The current FundDeployer contract address\\r\\n    function getCurrentFundDeployer()\\r\\n        external\\r\\n        view\\r\\n        override\\r\\n        returns (address currentFundDeployer_)\\r\\n    {\\r\\n        return currentFundDeployer;\\r\\n    }\\r\\n\\r\\n    /// @notice Gets the FundDeployer with which a given VaultProxy is associated\\r\\n    /// @param _vaultProxy The VaultProxy instance\\r\\n    /// @return fundDeployer_ The FundDeployer contract address\\r\\n    function getFundDeployerForVaultProxy(address _vaultProxy)\\r\\n        external\\r\\n        view\\r\\n        override\\r\\n        returns (address fundDeployer_)\\r\\n    {\\r\\n        return vaultProxyToFundDeployer[_vaultProxy];\\r\\n    }\\r\\n\\r\\n    /// @notice Gets the details of a pending migration request for a given VaultProxy\\r\\n    /// @param _vaultProxy The VaultProxy instance\\r\\n    /// @return nextFundDeployer_ The FundDeployer contract address from which the migration\\r\\n    /// request was made\\r\\n    /// @return nextVaultAccessor_ The account that will be the next `accessor` on the VaultProxy\\r\\n    /// @return nextVaultLib_ The next VaultLib library contract address to set on the VaultProxy\\r\\n    /// @return executableTimestamp_ The timestamp at which the migration request can be executed\\r\\n    function getMigrationRequestDetailsForVaultProxy(address _vaultProxy)\\r\\n        external\\r\\n        view\\r\\n        override\\r\\n        returns (\\r\\n            address nextFundDeployer_,\\r\\n            address nextVaultAccessor_,\\r\\n            address nextVaultLib_,\\r\\n            uint256 executableTimestamp_\\r\\n        )\\r\\n    {\\r\\n        MigrationRequest memory r = vaultProxyToMigrationRequest[_vaultProxy];\\r\\n        if (r.executableTimestamp > 0) {\\r\\n            return (\\r\\n                r.nextFundDeployer,\\r\\n                r.nextVaultAccessor,\\r\\n                r.nextVaultLib,\\r\\n                r.executableTimestamp\\r\\n            );\\r\\n        }\\r\\n    }\\r\\n\\r\\n    /// @notice Gets the amount of time that must pass between signaling and executing a migration\\r\\n    /// @return migrationTimelock_ The timelock value (in seconds)\\r\\n    function getMigrationTimelock() external view override returns (uint256 migrationTimelock_) {\\r\\n        return migrationTimelock;\\r\\n    }\\r\\n\\r\\n    /// @notice Gets the account that is nominated to be the next owner of this contract\\r\\n    /// @return nominatedOwner_ The account that is nominated to be the owner\\r\\n    function getNominatedOwner() external view override returns (address nominatedOwner_) {\\r\\n        return nominatedOwner;\\r\\n    }\\r\\n\\r\\n    /// @notice Gets the owner of this contract\\r\\n    /// @return owner_ The account that is the owner\\r\\n    function getOwner() external view override returns (address owner_) {\\r\\n        return owner;\\r\\n    }\\r\\n\\r\\n    /// @notice Gets the shares token `symbol` value for use in VaultProxy instances\\r\\n    /// @return sharesTokenSymbol_ The `symbol` value\\r\\n    function getSharesTokenSymbol()\\r\\n        external\\r\\n        view\\r\\n        override\\r\\n        returns (string memory sharesTokenSymbol_)\\r\\n    {\\r\\n        return sharesTokenSymbol;\\r\\n    }\\r\\n\\r\\n    /// @notice Gets the time remaining until the migration request of a given VaultProxy can be executed\\r\\n    /// @param _vaultProxy The VaultProxy instance\\r\\n    /// @return secondsRemaining_ The number of seconds remaining on the timelock\\r\\n    function getTimelockRemainingForMigrationRequest(address _vaultProxy)\\r\\n        external\\r\\n        view\\r\\n        override\\r\\n        returns (uint256 secondsRemaining_)\\r\\n    {\\r\\n        uint256 executableTimestamp = vaultProxyToMigrationRequest[_vaultProxy]\\r\\n            .executableTimestamp;\\r\\n        if (executableTimestamp == 0) {\\r\\n            return 0;\\r\\n        }\\r\\n\\r\\n        if (block.timestamp >= executableTimestamp) {\\r\\n            return 0;\\r\\n        }\\r\\n\\r\\n        return executableTimestamp - block.timestamp;\\r\\n    }\\r\\n\\r\\n    /// @notice Checks whether a migration request that is executable exists for a given VaultProxy\\r\\n    /// @param _vaultProxy The VaultProxy instance\\r\\n    /// @return hasExecutableRequest_ True if a migration request exists and is executable\\r\\n    function hasExecutableMigrationRequest(address _vaultProxy)\\r\\n        external\\r\\n        view\\r\\n        override\\r\\n        returns (bool hasExecutableRequest_)\\r\\n    {\\r\\n        uint256 executableTimestamp = vaultProxyToMigrationRequest[_vaultProxy]\\r\\n            .executableTimestamp;\\r\\n\\r\\n        return executableTimestamp > 0 && block.timestamp >= executableTimestamp;\\r\\n    }\\r\\n\\r\\n    /// @notice Checks whether a migration request exists for a given VaultProxy\\r\\n    /// @param _vaultProxy The VaultProxy instance\\r\\n    /// @return hasMigrationRequest_ True if a migration request exists\\r\\n    function hasMigrationRequest(address _vaultProxy)\\r\\n        external\\r\\n        view\\r\\n        override\\r\\n        returns (bool hasMigrationRequest_)\\r\\n    {\\r\\n        return vaultProxyToMigrationRequest[_vaultProxy].executableTimestamp > 0;\\r\\n    }\\r\\n}\\r\\n\",\"keccak256\":\"0x0d50f5ce05f825d31e5c12c2b2c6ea3b9d5175549dba11267c1b9601dc429429\",\"license\":\"GPL-3.0\"},\"contracts/persistent/dispatcher/IDispatcher.sol\":{\"content\":\"// SPDX-License-Identifier: GPL-3.0\\r\\n\\r\\n\\r\\n\\r\\npragma solidity 0.6.12;\\r\\n\\r\\n/// @title IDispatcher Interface\\r\\ninterface IDispatcher {\\r\\n    function cancelMigration(address _vaultProxy, bool _bypassFailure) external;\\r\\n\\r\\n    function claimOwnership() external;\\r\\n\\r\\n    function deployVaultProxy(\\r\\n        address _vaultLib,\\r\\n        address _owner,\\r\\n        address _vaultAccessor,\\r\\n        string calldata _fundName\\r\\n    ) external returns (address vaultProxy_);\\r\\n\\r\\n    function executeMigration(address _vaultProxy, bool _bypassFailure) external;\\r\\n\\r\\n    function getCurrentFundDeployer() external view returns (address currentFundDeployer_);\\r\\n\\r\\n    function getFundDeployerForVaultProxy(address _vaultProxy)\\r\\n        external\\r\\n        view\\r\\n        returns (address fundDeployer_);\\r\\n\\r\\n    function getMigrationRequestDetailsForVaultProxy(address _vaultProxy)\\r\\n        external\\r\\n        view\\r\\n        returns (\\r\\n            address nextFundDeployer_,\\r\\n            address nextVaultAccessor_,\\r\\n            address nextVaultLib_,\\r\\n            uint256 executableTimestamp_\\r\\n        );\\r\\n\\r\\n    function getMigrationTimelock() external view returns (uint256 migrationTimelock_);\\r\\n\\r\\n    function getNominatedOwner() external view returns (address nominatedOwner_);\\r\\n\\r\\n    function getOwner() external view returns (address owner_);\\r\\n\\r\\n    function getSharesTokenSymbol() external view returns (string memory sharesTokenSymbol_);\\r\\n\\r\\n    function getTimelockRemainingForMigrationRequest(address _vaultProxy)\\r\\n        external\\r\\n        view\\r\\n        returns (uint256 secondsRemaining_);\\r\\n\\r\\n    function hasExecutableMigrationRequest(address _vaultProxy)\\r\\n        external\\r\\n        view\\r\\n        returns (bool hasExecutableRequest_);\\r\\n\\r\\n    function hasMigrationRequest(address _vaultProxy)\\r\\n        external\\r\\n        view\\r\\n        returns (bool hasMigrationRequest_);\\r\\n\\r\\n    function removeNominatedOwner() external;\\r\\n\\r\\n    function setCurrentFundDeployer(address _nextFundDeployer) external;\\r\\n\\r\\n    function setMigrationTimelock(uint256 _nextTimelock) external;\\r\\n\\r\\n    function setNominatedOwner(address _nextNominatedOwner) external;\\r\\n\\r\\n    function setSharesTokenSymbol(string calldata _nextSymbol) external;\\r\\n\\r\\n    function signalMigration(\\r\\n        address _vaultProxy,\\r\\n        address _nextVaultAccessor,\\r\\n        address _nextVaultLib,\\r\\n        bool _bypassFailure\\r\\n    ) external;\\r\\n}\\r\\n\",\"keccak256\":\"0x9f2f0d998dc8beb620c2b4f0758b3884437b1dab9379eac561c8d98d70e1a81a\",\"license\":\"GPL-3.0\"},\"contracts/persistent/utils/IMigratableVault.sol\":{\"content\":\"// SPDX-License-Identifier: GPL-3.0\\r\\n\\r\\n\\r\\n\\r\\npragma solidity 0.6.12;\\r\\n\\r\\n/// @title IMigratableVault Interface\\r\\n/// @dev DO NOT EDIT CONTRACT\\r\\ninterface IMigratableVault {\\r\\n    function canMigrate(address _who) external view returns (bool canMigrate_);\\r\\n\\r\\n    function init(\\r\\n        address _owner,\\r\\n        address _accessor,\\r\\n        string calldata _fundName\\r\\n    ) external;\\r\\n\\r\\n    function setAccessor(address _nextAccessor) external;\\r\\n\\r\\n    function setVaultLib(address _nextVaultLib) external;\\r\\n}\\r\\n\",\"keccak256\":\"0x1210d49cd7c30f8d7ee6d65236a94bfd7d7572d256d422b8adf807f036711d3b\",\"license\":\"GPL-3.0\"},\"contracts/persistent/utils/IMigrationHookHandler.sol\":{\"content\":\"// SPDX-License-Identifier: GPL-3.0\\r\\n\\r\\n\\r\\n\\r\\npragma solidity 0.6.12;\\r\\n\\r\\n/// @title IMigrationHookHandler Interface\\r\\ninterface IMigrationHookHandler {\\r\\n    enum MigrationOutHook {\\r\\n        PreSignal,\\r\\n        PostSignal,\\r\\n        PreMigrate,\\r\\n        PostMigrate,\\r\\n        PostCancel\\r\\n    }\\r\\n\\r\\n    function invokeMigrationInCancelHook(\\r\\n        address _vaultProxy,\\r\\n        address _prevFundDeployer,\\r\\n        address _nextVaultAccessor,\\r\\n        address _nextVaultLib\\r\\n    ) external;\\r\\n\\r\\n    function invokeMigrationOutHook(\\r\\n        MigrationOutHook _hook,\\r\\n        address _vaultProxy,\\r\\n        address _nextFundDeployer,\\r\\n        address _nextVaultAccessor,\\r\\n        address _nextVaultLib\\r\\n    ) external;\\r\\n}\\r\\n\",\"keccak256\":\"0x94191caebd6bcdee3f5e6293a8b649a9016348adc7a1937c54957b0396b83a66\",\"license\":\"GPL-3.0\"},\"contracts/persistent/vault/VaultProxy.sol\":{\"content\":\"// SPDX-License-Identifier: GPL-3.0\\r\\n\\r\\n\\r\\n\\r\\npragma solidity 0.6.12;\\r\\n\\r\\nimport \\\"./utils/ProxiableVaultLib.sol\\\";\\r\\n\\r\\n/// @title VaultProxy Contract\\r\\n/// @notice A proxy contract for all VaultProxy instances, slightly modified from EIP-1822\\r\\n/// @dev Adapted from the recommended implementation of a Proxy in EIP-1822, updated for solc 0.6.12,\\r\\n/// and using the EIP-1967 storage slot for the proxiable implementation.\\r\\n/// i.e., `bytes32(uint256(keccak256('eip1967.proxy.implementation')) - 1)`, which is\\r\\n/// \\\"0x360894a13ba1a3210667c828492db98dca3e2076cc3735a920a3ca505d382bbc\\\"\\r\\n/// See: https://eips.ethereum.org/EIPS/eip-1822\\r\\ncontract VaultProxy {\\r\\n    constructor(bytes memory _constructData, address _vaultLib) public {\\r\\n        // \\\"0x027b9570e9fedc1a80b937ae9a06861e5faef3992491af30b684a64b3fbec7a5\\\" corresponds to\\r\\n        // `bytes32(keccak256('mln.proxiable.vaultlib'))`\\r\\n        require(\\r\\n            bytes32(0x027b9570e9fedc1a80b937ae9a06861e5faef3992491af30b684a64b3fbec7a5) ==\\r\\n                ProxiableVaultLib(_vaultLib).proxiableUUID(),\\r\\n            \\\"constructor: _vaultLib not compatible\\\"\\r\\n        );\\r\\n\\r\\n        assembly {\\r\\n            // solium-disable-line\\r\\n            sstore(0x360894a13ba1a3210667c828492db98dca3e2076cc3735a920a3ca505d382bbc, _vaultLib)\\r\\n        }\\r\\n\\r\\n        (bool success, bytes memory returnData) = _vaultLib.delegatecall(_constructData); // solium-disable-line\\r\\n        require(success, string(returnData));\\r\\n    }\\r\\n\\r\\n    fallback() external payable {\\r\\n        assembly {\\r\\n            // solium-disable-line\\r\\n            let contractLogic := sload(\\r\\n                0x360894a13ba1a3210667c828492db98dca3e2076cc3735a920a3ca505d382bbc\\r\\n            )\\r\\n            calldatacopy(0x0, 0x0, calldatasize())\\r\\n            let success := delegatecall(\\r\\n                sub(gas(), 10000),\\r\\n                contractLogic,\\r\\n                0x0,\\r\\n                calldatasize(),\\r\\n                0,\\r\\n                0\\r\\n            )\\r\\n            let retSz := returndatasize()\\r\\n            returndatacopy(0, 0, retSz)\\r\\n            switch success\\r\\n            case 0 {\\r\\n                revert(0, retSz)\\r\\n            }\\r\\n            default {\\r\\n                return(0, retSz)\\r\\n            }\\r\\n        }\\r\\n    }\\r\\n}\\r\\n\",\"keccak256\":\"0x9654d0025abbfb04e523d0f79f4f607344bccc8ca6b412d43e1ee6c50783d761\",\"license\":\"GPL-3.0\"},\"contracts/persistent/vault/utils/ProxiableVaultLib.sol\":{\"content\":\"// SPDX-License-Identifier: GPL-3.0\\r\\n\\r\\n\\r\\n\\r\\npragma solidity 0.6.12;\\r\\n\\r\\n/// @title ProxiableVaultLib Contract\\r\\n/// @notice A contract that defines the upgrade behavior for VaultLib instances\\r\\n/// @dev The recommended implementation of the target of a proxy according to EIP-1822 and EIP-1967\\r\\n/// Code position in storage is `bytes32(uint256(keccak256('eip1967.proxy.implementation')) - 1)`,\\r\\n/// which is \\\"0x360894a13ba1a3210667c828492db98dca3e2076cc3735a920a3ca505d382bbc\\\".\\r\\nabstract contract ProxiableVaultLib {\\r\\n    /// @dev Updates the target of the proxy to be the contract at _nextVaultLib\\r\\n    function __updateCodeAddress(address _nextVaultLib) internal {\\r\\n        require(\\r\\n            bytes32(0x027b9570e9fedc1a80b937ae9a06861e5faef3992491af30b684a64b3fbec7a5) ==\\r\\n                ProxiableVaultLib(_nextVaultLib).proxiableUUID(),\\r\\n            \\\"__updateCodeAddress: _nextVaultLib not compatible\\\"\\r\\n        );\\r\\n        assembly {\\r\\n            // solium-disable-line\\r\\n            sstore(\\r\\n                0x360894a13ba1a3210667c828492db98dca3e2076cc3735a920a3ca505d382bbc,\\r\\n                _nextVaultLib\\r\\n            )\\r\\n        }\\r\\n    }\\r\\n\\r\\n    /// @notice Returns a unique bytes32 hash for VaultLib instances\\r\\n    /// @return uuid_ The bytes32 hash representing the UUID\\r\\n    /// @dev The UUID is `bytes32(keccak256('mln.proxiable.vaultlib'))`\\r\\n    function proxiableUUID() public pure returns (bytes32 uuid_) {\\r\\n        return 0x027b9570e9fedc1a80b937ae9a06861e5faef3992491af30b684a64b3fbec7a5;\\r\\n    }\\r\\n}\\r\\n\",\"keccak256\":\"0x3dc960cd124e456ec7dc07a9fdc00208f3970a58079bd00941a7518d899f5261\",\"license\":\"GPL-3.0\"}},\"version\":1}",
  "bytecode": "0x60806040523480156200001157600080fd5b506202a300600355600280546001600160a01b031916331790556040805180820190915260068082526554414f44414f60d01b60209092019182526200005a9160049162000061565b50620000fd565b828054600181600116156101000203166002900490600052602060002090601f016020900481019282601f10620000a457805160ff1916838001178555620000d4565b82800160010185558215620000d4579182015b82811115620000d4578251825591602001919060010190620000b7565b50620000e2929150620000e6565b5090565b5b80821115620000e25760008155600101620000e7565b61299d806200010d6000396000f3fe60806040523480156200001157600080fd5b5060043610620001485760003560e01c806377a8c62411620000bd57806397af7050116200007b57806397af7050146200042d5780639c9d48da1462000456578063b47b06001462000487578063d0449d3d1462000509578063d15f9b9c14620005325762000148565b806377a8c62414620003885780637c77b2ed14620003b15780637dad9fc814620003bb5780638156eecf1462000419578063893d20e814620004235762000148565b80633d7c74f8116200010b5780633d7c74f814620002795780634e71e0c814620002a257806366231cea14620002ac578063728e17a014620002e9578063757bc0dd14620003125762000148565b80631df419f7146200014d57806322a0c08b146200016f578063288b6a3614620002225780632fa0c161146200022c57806338b3eb1b1462000248575b600080fd5b6200016d600480360360208110156200016557600080fd5b503562000573565b005b62000206600480360360808110156200018757600080fd5b6001600160a01b0382358116926020810135821692604082013590921691810190608081016060820135640100000000811115620001c457600080fd5b820183602082011115620001d757600080fd5b80359060200191846001830284011164010000000083111715620001fa57600080fd5b50909250905062000646565b604080516001600160a01b039092168252519081900360200190f35b62000206620008df565b62000236620008ee565b60408051918252519081900360200190f35b6200016d600480360360408110156200026057600080fd5b506001600160a01b0381351690602001351515620008f4565b62000206600480360360208110156200029157600080fd5b50356001600160a01b031662000c46565b6200016d62000c67565b620002d560048036036020811015620002c457600080fd5b50356001600160a01b031662000d10565b604080519115158252519081900360200190f35b6200016d600480360360208110156200030157600080fd5b50356001600160a01b031662000d43565b6200016d600480360360208110156200032a57600080fd5b8101906020810181356401000000008111156200034657600080fd5b8201836020820111156200035957600080fd5b803590602001918460018302840111640100000000831117156200037c57600080fd5b50909250905062000ebd565b6200023660048036036020811015620003a057600080fd5b50356001600160a01b031662000f7b565b6200020662000fc4565b620003e460048036036020811015620003d357600080fd5b50356001600160a01b031662000fd3565b604080516001600160a01b03958616815293851660208501529190931682820152606082019290925290519081900360800190f35b6200016d6200106b565b6200020662001147565b6200016d600480360360208110156200044557600080fd5b50356001600160a01b031662001156565b6200016d600480360360408110156200046e57600080fd5b506001600160a01b0381351690602001351515620012e1565b620004916200152a565b6040805160208082528351818301528351919283929083019185019080838360005b83811015620004cd578181015183820152602001620004b3565b50505050905090810190601f168015620004fb5780820380516001836020036101000a031916815260200191505b509250505060405180910390f35b620002d5600480360360208110156200052157600080fd5b50356001600160a01b0316620015c4565b6200016d600480360360808110156200054a57600080fd5b506001600160a01b038135811691602081013582169160408201351690606001351515620015e4565b6002546001600160a01b03163314620005be5760405162461bcd60e51b815260040180806020018281038252602e81526020018062002665602e913960400191505060405180910390fd5b60035481811415620006025760405162461bcd60e51b815260040180806020018281038252603b8152602001806200292d603b913960400191505060405180910390fd5b6003829055604080518281526020810184905281517f481ce28a1145a5d9b59e2d1d7eba33bc3350124def8fdc91032238d343ad5361929181900390910190a15050565b600080546001600160a01b03163314620006925760405162461bcd60e51b8152600401808060200182810382526034815260200180620024df6034913960400191505060405180910390fd5b6200069d8462001832565b620006da5760405162461bcd60e51b815260040180806020018281038252602d815260200180620026c4602d913960400191505060405180910390fd5b6060635c9a6d3760e01b8686868660405160240180856001600160a01b03168152602001846001600160a01b0316815260200180602001828103825284848281815260200192508082843760008382015260408051601f909201601f1990811690940182810390940182529283526020810180516001600160e01b03166001600160e01b0319909b169a909a17909952505196975087968e965062000786955093506200204c92505050565b8080602001836001600160a01b03168152602001828103825284818151815260200191508051906020019080838360005b83811015620007d1578181015183820152602001620007b7565b50505050905090810190601f168015620007ff5780820380516001836020036101000a031916815260200191505b509350505050604051809103906000f08015801562000822573d6000803e3d6000fd5b506001600160a01b0380821660008181526005602090815260409182902080546001600160a01b0319163390811790915582519384528a85169184019190915260609183018281529183018890529395508a8316928a169184917fa50560b448ad796ef60adfeffe1c19ed34daf94c2aa6905d0e209017dbc19f589188918c918c918c919060808201848480828437600083820152604051601f909101601f191690920182900397509095505050505050a4505095945050505050565b6001546001600160a01b031690565b60035490565b620008fe6200205a565b506001600160a01b038083166000908152600660209081526040918290208251608081018452815485168082526001830154861693820193909352600282015490941692840192909252600390910154606083015280620009915760405162461bcd60e51b815260040180806020018281038252603d815260200180620028f0603d913960400191505060405180910390fd5b336001600160a01b03821614620009da5760405162461bcd60e51b8152600401808060200182810382526045815260200180620027c56045913960600191505060405180910390fd5b6000546001600160a01b0382811691161462000a285760405162461bcd60e51b815260040180806020018281038252604f81526020018062002616604f913960600191505060405180910390fd5b60608201514281111562000a6e5760405162461bcd60e51b8152600401808060200182810382526038815260200180620027526038913960400191505060405180910390fd5b6001600160a01b0380861660009081526005602090815260409182902054908601519186015192169162000aa9600289858886868d62001838565b876001600160a01b0316634140d607826040518263ffffffff1660e01b815260040180826001600160a01b03168152602001915050600060405180830381600087803b15801562000af957600080fd5b505af115801562000b0e573d6000803e3d6000fd5b50505050876001600160a01b031663ab9253ac836040518263ffffffff1660e01b815260040180826001600160a01b03168152602001915050600060405180830381600087803b15801562000b6257600080fd5b505af115801562000b77573d6000803e3d6000fd5b5050506001600160a01b03808a1660009081526005602090815260408083208054948b166001600160a01b0319958616179055600690915281208054831681556001810180548416905560028101805490931690925560039182015562000be5915089858886868d62001838565b604080516001600160a01b038481168252838116602083015281830187905291518288169286811692908c16917fad6fb3d36e2cda148dfd43203c1a40c0da9a9baa662ae9d6c3b0c3e4a9d6a6359181900360600190a45050505050505050565b6001600160a01b03808216600090815260056020526040902054165b919050565b6001546001600160a01b031633811462000cb35760405162461bcd60e51b815260040180806020018281038252603e81526020018062002845603e913960400191505060405180910390fd5b600180546001600160a01b0319908116909155600280546001600160a01b0384811693821684179092556040519116919082907f8be0079c531659141344cd1fd0a4f28419497f9722a3daafe3b4186f6b6457e090600090a35050565b6001600160a01b038116600090815260066020526040812060030154801580159062000d3c5750804210155b9392505050565b6002546001600160a01b0316331462000d8e5760405162461bcd60e51b815260040180806020018281038252602e81526020018062002665602e913960400191505060405180910390fd5b6001600160a01b03811662000dd55760405162461bcd60e51b8152600401808060200182810382526036815260200180620026f16036913960400191505060405180910390fd5b6002546001600160a01b038281169116141562000e245760405162461bcd60e51b815260040180806020018281038252603b8152602001806200278a603b913960400191505060405180910390fd5b6001546001600160a01b038281169116141562000e735760405162461bcd60e51b815260040180806020018281038252603b8152602001806200280a603b913960400191505060405180910390fd5b600180546001600160a01b0319166001600160a01b0383169081179091556040517f132c19de901bb4ed8403c34734b6c841d5dc57745824da452a52433519ea5abf90600090a250565b6002546001600160a01b0316331462000f085760405162461bcd60e51b815260040180806020018281038252602e81526020018062002665602e913960400191505060405180910390fd5b62000f166004838362002081565b507ff0115712c23b609855a28d7b8963c6d16d732ae388b11e5d4ec6d5eae4ad8698828260405180806020018281038252848482818152602001925080828437600083820152604051601f909101601f19169092018290039550909350505050a15050565b6001600160a01b0381166000908152600660205260408120600301548062000fa857600091505062000c62565b80421062000fbb57600091505062000c62565b42900392915050565b6000546001600160a01b031690565b60008060008062000fe36200205a565b506001600160a01b038086166000908152600660209081526040918290208251608081018452815485168152600182015485169281019290925260028101549093169181019190915260039091015460608201819052156200106257806000015181602001518260400151836060015194509450945094505062001064565b505b9193509193565b6002546001600160a01b03163314620010b65760405162461bcd60e51b815260040180806020018281038252602e81526020018062002665602e913960400191505060405180910390fd5b6001546001600160a01b031680620011005760405162461bcd60e51b8152600401808060200182810382526031815260200180620026936031913960400191505060405180910390fd5b600180546001600160a01b03191690556040516001600160a01b038216907fe4136584a5e8bb85d66301f3ce8b11cc2e5a8bea3979f10ea2451353849acc4790600090a250565b6002546001600160a01b031690565b6002546001600160a01b03163314620011a15760405162461bcd60e51b815260040180806020018281038252602e81526020018062002665602e913960400191505060405180910390fd5b6001600160a01b038116620011e85760405162461bcd60e51b8152600401808060200182810382526039815260200180620025b76039913960400191505060405180910390fd5b620011f38162001832565b620012305760405162461bcd60e51b8152600401808060200182810382526036815260200180620028ba6036913960400191505060405180910390fd5b6000546001600160a01b03908116908216811415620012815760405162461bcd60e51b8152600401808060200182810382526048815260200180620025436048913960600191505060405180910390fd5b600080546001600160a01b0319166001600160a01b03848116918217909255604080519284168352602083019190915280517f44cf34a26ccbaa8a20e6098a1278e28682572ec9921eb43d8dab274a503e92f59281900390910190a15050565b620012eb6200205a565b506001600160a01b0380831660009081526006602090815260409182902082516080810184528154851680825260018301548616938201939093526002820154909416928401929092526003909101546060830152806200137e5760405162461bcd60e51b815260040180806020018281038252602c8152602001806200258b602c913960400191505060405180910390fd5b336001600160a01b038216148062001407575060408051633ef03e7560e11b815233600482015290516001600160a01b03861691637de07cea916024808301926020929190829003018186803b158015620013d857600080fd5b505afa158015620013ed573d6000803e3d6000fd5b505050506040513d60208110156200140457600080fd5b50515b620014445760405162461bcd60e51b8152600401808060200182810382526026815260200180620025f06026913960400191505060405180910390fd5b6001600160a01b0380851660009081526005602090815260408083205486830151878301516060890151600690955292852080546001600160a01b03199081168255600182018054821690556002820180549091169055600301949094559093169290620014b9600489868887878d62001838565b620014c988858786868c62001bd1565b604080516001600160a01b038581168252848116602083015281830184905291518288169287811692908c16917f9851a8f232c380eb2c1065756776e37d85d4fe0c8cb4005b0d72c749bfef923e9181900360600190a45050505050505050565b60048054604080516020601f6002600019610100600188161502019095169490940493840181900481028201810190925282815260609390929091830182828015620015ba5780601f106200158e57610100808354040283529160200191620015ba565b820191906000526020600020905b8154815290600101906020018083116200159c57829003601f168201915b5050505050905090565b6001600160a01b0316600090815260066020526040902060030154151590565b6000546001600160a01b031633146200162f5760405162461bcd60e51b8152600401808060200182810382526034815260200180620024df6034913960400191505060405180910390fd5b6200163a8362001832565b620016775760405162461bcd60e51b8152600401808060200182810382526030815260200180620025136030913960400191505060405180910390fd5b6001600160a01b038085166000908152600560205260409020541680620016d05760405162461bcd60e51b815260040180806020018281038252602b81526020018062002727602b913960400191505060405180910390fd5b336001600160a01b0382168114156200171b5760405162461bcd60e51b8152600401808060200182810382526037815260200180620028836037913960400191505060405180910390fd5b6200172d600087848489898962001838565b60038054604080516080810182526001600160a01b03808616825289811660208084019182528a831684860190815242909601606085018181528e85166000908152600690935295909120935184549084166001600160a01b0319918216178555915160018086018054928616928516929092179091559551600285018054919094169216919091179091559151930192909255620017d2908885858a8a8a62001838565b604080516001600160a01b038881168252878116602083015281830184905291518285169286811692908b16917fb519c42fdb88f83f098814813f2ebff14fbf14f3e68b054e5a98834c69d54bfb9181900360600190a450505050505050565b3b151590565b60006060866001600160a01b0316633f84c12c60e01b8a8a898989604051602401808660048111156200186757fe5b8152602001856001600160a01b03168152602001846001600160a01b03168152602001836001600160a01b03168152602001826001600160a01b0316815260200195505050505050604051602081830303815290604052906001600160e01b0319166020820180516001600160e01b0383818316178352505050506040518082805190602001908083835b60208310620019135780518252601f199092019160209182019101620018f2565b6001836020036101000a0380198251168184511680821785525050505050509050019150506000604051808303816000865af19150503d806000811462001977576040519150601f19603f3d011682016040523d82523d6000602084013e6200197c565b606091505b50915091508162001bc65782620019938a62001ea1565b826040516020018083805190602001908083835b60208310620019c85780518252601f199092019160209182019101620019a7565b51815160209384036101000a600019018019909216911617905285519190930192850191508083835b6020831062001a125780518252601f199092019160209182019101620019f1565b6001836020036101000a038019825116818451168082178552505050505050905001925050506040516020818303038152906040529062001ad45760405162461bcd60e51b81526004018080602001828103825283818151815260200191508051906020019080838360005b8381101562001a9857818101518382015260200162001a7e565b50505050905090810190601f16801562001ac65780820380516001836020036101000a031916815260200191505b509250505060405180910390fd5b50856001600160a01b0316876001600160a01b0316896001600160a01b03167fbf0ae6830883bd89855f2e7b17a2924b5de0b2b3d4a8834d7c2c0d5dc53447db848d8a8a604051808060200185600481111562001b2d57fe5b8152602001846001600160a01b03168152602001836001600160a01b03168152602001828103825286818151815260200191508051906020019080838360005b8381101562001b8757818101518382015260200162001b6d565b50505050905090810190601f16801562001bb55780820380516001836020036101000a031916815260200191505b509550505050505060405180910390a45b505050505050505050565b604080516001600160a01b038881166024830152878116604483015285811660648301528481166084808401919091528351808403909101815260a490920183526020820180516001600160e01b031663df369ba760e01b17815292518251600094606094938a169392918291908083835b6020831062001c645780518252601f19909201916020918201910162001c43565b6001836020036101000a0380198251168184511680821785525050505050509050019150506000604051808303816000865af19150503d806000811462001cc8576040519150601f19603f3d011682016040523d82523d6000602084013e62001ccd565b606091505b50915091508162001e9757828160405160200180807f4d6967726174696f6e4f757443616e63656c486f6f6b3a20000000000000000081525060180182805190602001908083835b6020831062001d365780518252601f19909201916020918201910162001d15565b6001836020036101000a0380198251168184511680821785525050505050509050019150506040516020818303038152906040529062001db95760405162461bcd60e51b815260206004820181815283516024840152835190928392604490910191908501908083836000831562001a9857818101518382015260200162001a7e565b50856001600160a01b0316876001600160a01b0316896001600160a01b03167f7c79070aa51adb676fb9c8d0f7a1f841ff9cf514444b37c95297ed1c52547b328489896040518080602001846001600160a01b03168152602001836001600160a01b03168152602001828103825285818151815260200191508051906020019080838360005b8381101562001e5957818101518382015260200162001e3f565b50505050905090810190601f16801562001e875780820380516001836020036101000a031916815260200191505b5094505050505060405180910390a45b5050505050505050565b6060600082600481111562001eb257fe5b141562001ef4575060408051808201909152601c81527f4d6967726174696f6e4f7574486f6f6b2e5072655369676e616c3a2000000000602082015262000c62565b600182600481111562001f0357fe5b141562001f45575060408051808201909152601d81527f4d6967726174696f6e4f7574486f6f6b2e506f73745369676e616c3a20000000602082015262000c62565b600282600481111562001f5457fe5b141562001f96575060408051808201909152601d81527f4d6967726174696f6e4f7574486f6f6b2e5072654d6967726174653a20000000602082015262000c62565b600382600481111562001fa557fe5b141562001fe7575060408051808201909152601e81527f4d6967726174696f6e4f7574486f6f6b2e506f73744d6967726174653a200000602082015262000c62565b600482600481111562001ff657fe5b141562002038575060408051808201909152601d81527f4d6967726174696f6e4f7574486f6f6b2e506f737443616e63656c3a20000000602082015262000c62565b505060408051602081019091526000815290565b6103c1806200211e83390190565b60408051608081018252600080825260208201819052918101829052606081019190915290565b828054600181600116156101000203166002900490600052602060002090601f016020900481019282601f10620020c45782800160ff19823516178555620020f4565b82800160010185558215620020f4579182015b82811115620020f4578235825591602001919060010190620020d7565b506200210292915062002106565b5090565b5b808211156200210257600081556001016200210756fe608060405234801561001057600080fd5b506040516103c13803806103c18339818101604052604081101561003357600080fd5b810190808051604051939291908464010000000082111561005357600080fd5b90830190602082018581111561006857600080fd5b825164010000000081118282018810171561008257600080fd5b82525081516020918201929091019080838360005b838110156100af578181015183820152602001610097565b50505050905090810190601f1680156100dc5780820380516001836020036101000a031916815260200191505b5060408181526020928301516352d1902d60e01b835290519094506001600160a01b03851693506352d1902d92600480840193919291829003018186803b15801561012657600080fd5b505afa15801561013a573d6000803e3d6000fd5b505050506040513d602081101561015057600080fd5b50517f027b9570e9fedc1a80b937ae9a06861e5faef3992491af30b684a64b3fbec7a5146101af5760405162461bcd60e51b815260040180806020018281038252602581526020018061039c6025913960400191505060405180910390fd5b807f360894a13ba1a3210667c828492db98dca3e2076cc3735a920a3ca505d382bbc5560006060826001600160a01b0316846040518082805190602001908083835b602083106102105780518252601f1990920191602091820191016101f1565b6001836020036101000a038019825116818451168082178552505050505050905001915050600060405180830381855af49150503d8060008114610270576040519150601f19603f3d011682016040523d82523d6000602084013e610275565b606091505b50915091508181906103055760405162461bcd60e51b81526004018080602001828103825283818151815260200191508051906020019080838360005b838110156102ca5781810151838201526020016102b2565b50505050905090810190601f1680156102f75780820380516001836020036101000a031916815260200191505b509250505060405180910390fd5b50505050506084806103186000396000f3fe60806040527f360894a13ba1a3210667c828492db98dca3e2076cc3735a920a3ca505d382bbc543660008037600080366000846127105a03f43d806000803e818015604957816000f35b816000fdfea2646970667358221220035d9150e603eadf995e60b49905802a6b32406f49081b8d18aafb5e8cc622f364736f6c634300060c0033636f6e7374727563746f723a205f7661756c744c6962206e6f7420636f6d70617469626c654f6e6c79207468652063757272656e742046756e644465706c6f7965722063616e2063616c6c20746869732066756e6374696f6e7369676e616c4d6967726174696f6e3a204e6f6e2d636f6e7472616374205f6e6578745661756c744163636573736f7273657443757272656e7446756e644465706c6f7965723a205f6e65787446756e644465706c6f79657220697320616c72656164792063757272656e7446756e644465706c6f79657263616e63656c4d6967726174696f6e3a204e6f206d6967726174696f6e20726571756573742065786973747373657443757272656e7446756e644465706c6f7965723a205f6e65787446756e644465706c6f7965722063616e6e6f7420626520656d70747963616e63656c4d6967726174696f6e3a204e6f7420616e20616c6c6f7765642063616c6c6572657865637574654d6967726174696f6e3a20546865207461726765742046756e644465706c6f796572206973206e6f206c6f6e676572207468652063757272656e742046756e644465706c6f7965724f6e6c792074686520636f6e7472616374206f776e65722063616e2063616c6c20746869732066756e6374696f6e72656d6f76654e6f6d696e617465644f776e65723a205468657265206973206e6f206e6f6d696e61746564206f776e65726465706c6f795661756c7450726f78793a204e6f6e2d636f6e7472616374205f7661756c744163636573736f727365744e6f6d696e617465644f776e65723a205f6e6578744e6f6d696e617465644f776e65722063616e6e6f7420626520656d7074797369676e616c4d6967726174696f6e3a205f7661756c7450726f787920646f6573206e6f74206578697374657865637574654d6967726174696f6e3a20546865206d6967726174696f6e2074696d656c6f636b20686173206e6f7420656c61707365647365744e6f6d696e617465644f776e65723a205f6e6578744e6f6d696e617465644f776e657220697320616c726561647920746865206f776e6572657865637574654d6967726174696f6e3a204f6e6c7920746865207461726765742046756e644465706c6f7965722063616e2063616c6c20746869732066756e6374696f6e7365744e6f6d696e617465644f776e65723a205f6e6578744e6f6d696e617465644f776e657220697320616c7265616479206e6f6d696e61746564636c61696d4f776e6572736869703a204f6e6c7920746865206e6f6d696e617465644f776e65722063616e2063616c6c20746869732066756e6374696f6e7369676e616c4d6967726174696f6e3a2043616e206f6e6c79206d69677261746520746f2061206e65772046756e644465706c6f79657273657443757272656e7446756e644465706c6f7965723a204e6f6e2d636f6e7472616374205f6e65787446756e644465706c6f796572657865637574654d6967726174696f6e3a204e6f206d6967726174696f6e20726571756573742065786973747320666f72205f7661756c7450726f78797365744d6967726174696f6e54696d656c6f636b3a205f6e65787454696d656c6f636b206973207468652063757272656e742074696d656c6f636ba2646970667358221220e21c90a1f1002e4e4a2969ff7beae142a0f9346224f2331772a357b8e2bbcaab64736f6c634300060c0033",
  "deployedBytecode": "0x60806040523480156200001157600080fd5b5060043610620001485760003560e01c806377a8c62411620000bd57806397af7050116200007b57806397af7050146200042d5780639c9d48da1462000456578063b47b06001462000487578063d0449d3d1462000509578063d15f9b9c14620005325762000148565b806377a8c62414620003885780637c77b2ed14620003b15780637dad9fc814620003bb5780638156eecf1462000419578063893d20e814620004235762000148565b80633d7c74f8116200010b5780633d7c74f814620002795780634e71e0c814620002a257806366231cea14620002ac578063728e17a014620002e9578063757bc0dd14620003125762000148565b80631df419f7146200014d57806322a0c08b146200016f578063288b6a3614620002225780632fa0c161146200022c57806338b3eb1b1462000248575b600080fd5b6200016d600480360360208110156200016557600080fd5b503562000573565b005b62000206600480360360808110156200018757600080fd5b6001600160a01b0382358116926020810135821692604082013590921691810190608081016060820135640100000000811115620001c457600080fd5b820183602082011115620001d757600080fd5b80359060200191846001830284011164010000000083111715620001fa57600080fd5b50909250905062000646565b604080516001600160a01b039092168252519081900360200190f35b62000206620008df565b62000236620008ee565b60408051918252519081900360200190f35b6200016d600480360360408110156200026057600080fd5b506001600160a01b0381351690602001351515620008f4565b62000206600480360360208110156200029157600080fd5b50356001600160a01b031662000c46565b6200016d62000c67565b620002d560048036036020811015620002c457600080fd5b50356001600160a01b031662000d10565b604080519115158252519081900360200190f35b6200016d600480360360208110156200030157600080fd5b50356001600160a01b031662000d43565b6200016d600480360360208110156200032a57600080fd5b8101906020810181356401000000008111156200034657600080fd5b8201836020820111156200035957600080fd5b803590602001918460018302840111640100000000831117156200037c57600080fd5b50909250905062000ebd565b6200023660048036036020811015620003a057600080fd5b50356001600160a01b031662000f7b565b6200020662000fc4565b620003e460048036036020811015620003d357600080fd5b50356001600160a01b031662000fd3565b604080516001600160a01b03958616815293851660208501529190931682820152606082019290925290519081900360800190f35b6200016d6200106b565b6200020662001147565b6200016d600480360360208110156200044557600080fd5b50356001600160a01b031662001156565b6200016d600480360360408110156200046e57600080fd5b506001600160a01b0381351690602001351515620012e1565b620004916200152a565b6040805160208082528351818301528351919283929083019185019080838360005b83811015620004cd578181015183820152602001620004b3565b50505050905090810190601f168015620004fb5780820380516001836020036101000a031916815260200191505b509250505060405180910390f35b620002d5600480360360208110156200052157600080fd5b50356001600160a01b0316620015c4565b6200016d600480360360808110156200054a57600080fd5b506001600160a01b038135811691602081013582169160408201351690606001351515620015e4565b6002546001600160a01b03163314620005be5760405162461bcd60e51b815260040180806020018281038252602e81526020018062002665602e913960400191505060405180910390fd5b60035481811415620006025760405162461bcd60e51b815260040180806020018281038252603b8152602001806200292d603b913960400191505060405180910390fd5b6003829055604080518281526020810184905281517f481ce28a1145a5d9b59e2d1d7eba33bc3350124def8fdc91032238d343ad5361929181900390910190a15050565b600080546001600160a01b03163314620006925760405162461bcd60e51b8152600401808060200182810382526034815260200180620024df6034913960400191505060405180910390fd5b6200069d8462001832565b620006da5760405162461bcd60e51b815260040180806020018281038252602d815260200180620026c4602d913960400191505060405180910390fd5b6060635c9a6d3760e01b8686868660405160240180856001600160a01b03168152602001846001600160a01b0316815260200180602001828103825284848281815260200192508082843760008382015260408051601f909201601f1990811690940182810390940182529283526020810180516001600160e01b03166001600160e01b0319909b169a909a17909952505196975087968e965062000786955093506200204c92505050565b8080602001836001600160a01b03168152602001828103825284818151815260200191508051906020019080838360005b83811015620007d1578181015183820152602001620007b7565b50505050905090810190601f168015620007ff5780820380516001836020036101000a031916815260200191505b509350505050604051809103906000f08015801562000822573d6000803e3d6000fd5b506001600160a01b0380821660008181526005602090815260409182902080546001600160a01b0319163390811790915582519384528a85169184019190915260609183018281529183018890529395508a8316928a169184917fa50560b448ad796ef60adfeffe1c19ed34daf94c2aa6905d0e209017dbc19f589188918c918c918c919060808201848480828437600083820152604051601f909101601f191690920182900397509095505050505050a4505095945050505050565b6001546001600160a01b031690565b60035490565b620008fe6200205a565b506001600160a01b038083166000908152600660209081526040918290208251608081018452815485168082526001830154861693820193909352600282015490941692840192909252600390910154606083015280620009915760405162461bcd60e51b815260040180806020018281038252603d815260200180620028f0603d913960400191505060405180910390fd5b336001600160a01b03821614620009da5760405162461bcd60e51b8152600401808060200182810382526045815260200180620027c56045913960600191505060405180910390fd5b6000546001600160a01b0382811691161462000a285760405162461bcd60e51b815260040180806020018281038252604f81526020018062002616604f913960600191505060405180910390fd5b60608201514281111562000a6e5760405162461bcd60e51b8152600401808060200182810382526038815260200180620027526038913960400191505060405180910390fd5b6001600160a01b0380861660009081526005602090815260409182902054908601519186015192169162000aa9600289858886868d62001838565b876001600160a01b0316634140d607826040518263ffffffff1660e01b815260040180826001600160a01b03168152602001915050600060405180830381600087803b15801562000af957600080fd5b505af115801562000b0e573d6000803e3d6000fd5b50505050876001600160a01b031663ab9253ac836040518263ffffffff1660e01b815260040180826001600160a01b03168152602001915050600060405180830381600087803b15801562000b6257600080fd5b505af115801562000b77573d6000803e3d6000fd5b5050506001600160a01b03808a1660009081526005602090815260408083208054948b166001600160a01b0319958616179055600690915281208054831681556001810180548416905560028101805490931690925560039182015562000be5915089858886868d62001838565b604080516001600160a01b038481168252838116602083015281830187905291518288169286811692908c16917fad6fb3d36e2cda148dfd43203c1a40c0da9a9baa662ae9d6c3b0c3e4a9d6a6359181900360600190a45050505050505050565b6001600160a01b03808216600090815260056020526040902054165b919050565b6001546001600160a01b031633811462000cb35760405162461bcd60e51b815260040180806020018281038252603e81526020018062002845603e913960400191505060405180910390fd5b600180546001600160a01b0319908116909155600280546001600160a01b0384811693821684179092556040519116919082907f8be0079c531659141344cd1fd0a4f28419497f9722a3daafe3b4186f6b6457e090600090a35050565b6001600160a01b038116600090815260066020526040812060030154801580159062000d3c5750804210155b9392505050565b6002546001600160a01b0316331462000d8e5760405162461bcd60e51b815260040180806020018281038252602e81526020018062002665602e913960400191505060405180910390fd5b6001600160a01b03811662000dd55760405162461bcd60e51b8152600401808060200182810382526036815260200180620026f16036913960400191505060405180910390fd5b6002546001600160a01b038281169116141562000e245760405162461bcd60e51b815260040180806020018281038252603b8152602001806200278a603b913960400191505060405180910390fd5b6001546001600160a01b038281169116141562000e735760405162461bcd60e51b815260040180806020018281038252603b8152602001806200280a603b913960400191505060405180910390fd5b600180546001600160a01b0319166001600160a01b0383169081179091556040517f132c19de901bb4ed8403c34734b6c841d5dc57745824da452a52433519ea5abf90600090a250565b6002546001600160a01b0316331462000f085760405162461bcd60e51b815260040180806020018281038252602e81526020018062002665602e913960400191505060405180910390fd5b62000f166004838362002081565b507ff0115712c23b609855a28d7b8963c6d16d732ae388b11e5d4ec6d5eae4ad8698828260405180806020018281038252848482818152602001925080828437600083820152604051601f909101601f19169092018290039550909350505050a15050565b6001600160a01b0381166000908152600660205260408120600301548062000fa857600091505062000c62565b80421062000fbb57600091505062000c62565b42900392915050565b6000546001600160a01b031690565b60008060008062000fe36200205a565b506001600160a01b038086166000908152600660209081526040918290208251608081018452815485168152600182015485169281019290925260028101549093169181019190915260039091015460608201819052156200106257806000015181602001518260400151836060015194509450945094505062001064565b505b9193509193565b6002546001600160a01b03163314620010b65760405162461bcd60e51b815260040180806020018281038252602e81526020018062002665602e913960400191505060405180910390fd5b6001546001600160a01b031680620011005760405162461bcd60e51b8152600401808060200182810382526031815260200180620026936031913960400191505060405180910390fd5b600180546001600160a01b03191690556040516001600160a01b038216907fe4136584a5e8bb85d66301f3ce8b11cc2e5a8bea3979f10ea2451353849acc4790600090a250565b6002546001600160a01b031690565b6002546001600160a01b03163314620011a15760405162461bcd60e51b815260040180806020018281038252602e81526020018062002665602e913960400191505060405180910390fd5b6001600160a01b038116620011e85760405162461bcd60e51b8152600401808060200182810382526039815260200180620025b76039913960400191505060405180910390fd5b620011f38162001832565b620012305760405162461bcd60e51b8152600401808060200182810382526036815260200180620028ba6036913960400191505060405180910390fd5b6000546001600160a01b03908116908216811415620012815760405162461bcd60e51b8152600401808060200182810382526048815260200180620025436048913960600191505060405180910390fd5b600080546001600160a01b0319166001600160a01b03848116918217909255604080519284168352602083019190915280517f44cf34a26ccbaa8a20e6098a1278e28682572ec9921eb43d8dab274a503e92f59281900390910190a15050565b620012eb6200205a565b506001600160a01b0380831660009081526006602090815260409182902082516080810184528154851680825260018301548616938201939093526002820154909416928401929092526003909101546060830152806200137e5760405162461bcd60e51b815260040180806020018281038252602c8152602001806200258b602c913960400191505060405180910390fd5b336001600160a01b038216148062001407575060408051633ef03e7560e11b815233600482015290516001600160a01b03861691637de07cea916024808301926020929190829003018186803b158015620013d857600080fd5b505afa158015620013ed573d6000803e3d6000fd5b505050506040513d60208110156200140457600080fd5b50515b620014445760405162461bcd60e51b8152600401808060200182810382526026815260200180620025f06026913960400191505060405180910390fd5b6001600160a01b0380851660009081526005602090815260408083205486830151878301516060890151600690955292852080546001600160a01b03199081168255600182018054821690556002820180549091169055600301949094559093169290620014b9600489868887878d62001838565b620014c988858786868c62001bd1565b604080516001600160a01b038581168252848116602083015281830184905291518288169287811692908c16917f9851a8f232c380eb2c1065756776e37d85d4fe0c8cb4005b0d72c749bfef923e9181900360600190a45050505050505050565b60048054604080516020601f6002600019610100600188161502019095169490940493840181900481028201810190925282815260609390929091830182828015620015ba5780601f106200158e57610100808354040283529160200191620015ba565b820191906000526020600020905b8154815290600101906020018083116200159c57829003601f168201915b5050505050905090565b6001600160a01b0316600090815260066020526040902060030154151590565b6000546001600160a01b031633146200162f5760405162461bcd60e51b8152600401808060200182810382526034815260200180620024df6034913960400191505060405180910390fd5b6200163a8362001832565b620016775760405162461bcd60e51b8152600401808060200182810382526030815260200180620025136030913960400191505060405180910390fd5b6001600160a01b038085166000908152600560205260409020541680620016d05760405162461bcd60e51b815260040180806020018281038252602b81526020018062002727602b913960400191505060405180910390fd5b336001600160a01b0382168114156200171b5760405162461bcd60e51b8152600401808060200182810382526037815260200180620028836037913960400191505060405180910390fd5b6200172d600087848489898962001838565b60038054604080516080810182526001600160a01b03808616825289811660208084019182528a831684860190815242909601606085018181528e85166000908152600690935295909120935184549084166001600160a01b0319918216178555915160018086018054928616928516929092179091559551600285018054919094169216919091179091559151930192909255620017d2908885858a8a8a62001838565b604080516001600160a01b038881168252878116602083015281830184905291518285169286811692908b16917fb519c42fdb88f83f098814813f2ebff14fbf14f3e68b054e5a98834c69d54bfb9181900360600190a450505050505050565b3b151590565b60006060866001600160a01b0316633f84c12c60e01b8a8a898989604051602401808660048111156200186757fe5b8152602001856001600160a01b03168152602001846001600160a01b03168152602001836001600160a01b03168152602001826001600160a01b0316815260200195505050505050604051602081830303815290604052906001600160e01b0319166020820180516001600160e01b0383818316178352505050506040518082805190602001908083835b60208310620019135780518252601f199092019160209182019101620018f2565b6001836020036101000a0380198251168184511680821785525050505050509050019150506000604051808303816000865af19150503d806000811462001977576040519150601f19603f3d011682016040523d82523d6000602084013e6200197c565b606091505b50915091508162001bc65782620019938a62001ea1565b826040516020018083805190602001908083835b60208310620019c85780518252601f199092019160209182019101620019a7565b51815160209384036101000a600019018019909216911617905285519190930192850191508083835b6020831062001a125780518252601f199092019160209182019101620019f1565b6001836020036101000a038019825116818451168082178552505050505050905001925050506040516020818303038152906040529062001ad45760405162461bcd60e51b81526004018080602001828103825283818151815260200191508051906020019080838360005b8381101562001a9857818101518382015260200162001a7e565b50505050905090810190601f16801562001ac65780820380516001836020036101000a031916815260200191505b509250505060405180910390fd5b50856001600160a01b0316876001600160a01b0316896001600160a01b03167fbf0ae6830883bd89855f2e7b17a2924b5de0b2b3d4a8834d7c2c0d5dc53447db848d8a8a604051808060200185600481111562001b2d57fe5b8152602001846001600160a01b03168152602001836001600160a01b03168152602001828103825286818151815260200191508051906020019080838360005b8381101562001b8757818101518382015260200162001b6d565b50505050905090810190601f16801562001bb55780820380516001836020036101000a031916815260200191505b509550505050505060405180910390a45b505050505050505050565b604080516001600160a01b038881166024830152878116604483015285811660648301528481166084808401919091528351808403909101815260a490920183526020820180516001600160e01b031663df369ba760e01b17815292518251600094606094938a169392918291908083835b6020831062001c645780518252601f19909201916020918201910162001c43565b6001836020036101000a0380198251168184511680821785525050505050509050019150506000604051808303816000865af19150503d806000811462001cc8576040519150601f19603f3d011682016040523d82523d6000602084013e62001ccd565b606091505b50915091508162001e9757828160405160200180807f4d6967726174696f6e4f757443616e63656c486f6f6b3a20000000000000000081525060180182805190602001908083835b6020831062001d365780518252601f19909201916020918201910162001d15565b6001836020036101000a0380198251168184511680821785525050505050509050019150506040516020818303038152906040529062001db95760405162461bcd60e51b815260206004820181815283516024840152835190928392604490910191908501908083836000831562001a9857818101518382015260200162001a7e565b50856001600160a01b0316876001600160a01b0316896001600160a01b03167f7c79070aa51adb676fb9c8d0f7a1f841ff9cf514444b37c95297ed1c52547b328489896040518080602001846001600160a01b03168152602001836001600160a01b03168152602001828103825285818151815260200191508051906020019080838360005b8381101562001e5957818101518382015260200162001e3f565b50505050905090810190601f16801562001e875780820380516001836020036101000a031916815260200191505b5094505050505060405180910390a45b5050505050505050565b6060600082600481111562001eb257fe5b141562001ef4575060408051808201909152601c81527f4d6967726174696f6e4f7574486f6f6b2e5072655369676e616c3a2000000000602082015262000c62565b600182600481111562001f0357fe5b141562001f45575060408051808201909152601d81527f4d6967726174696f6e4f7574486f6f6b2e506f73745369676e616c3a20000000602082015262000c62565b600282600481111562001f5457fe5b141562001f96575060408051808201909152601d81527f4d6967726174696f6e4f7574486f6f6b2e5072654d6967726174653a20000000602082015262000c62565b600382600481111562001fa557fe5b141562001fe7575060408051808201909152601e81527f4d6967726174696f6e4f7574486f6f6b2e506f73744d6967726174653a200000602082015262000c62565b600482600481111562001ff657fe5b141562002038575060408051808201909152601d81527f4d6967726174696f6e4f7574486f6f6b2e506f737443616e63656c3a20000000602082015262000c62565b505060408051602081019091526000815290565b6103c1806200211e83390190565b60408051608081018252600080825260208201819052918101829052606081019190915290565b828054600181600116156101000203166002900490600052602060002090601f016020900481019282601f10620020c45782800160ff19823516178555620020f4565b82800160010185558215620020f4579182015b82811115620020f4578235825591602001919060010190620020d7565b506200210292915062002106565b5090565b5b808211156200210257600081556001016200210756fe608060405234801561001057600080fd5b506040516103c13803806103c18339818101604052604081101561003357600080fd5b810190808051604051939291908464010000000082111561005357600080fd5b90830190602082018581111561006857600080fd5b825164010000000081118282018810171561008257600080fd5b82525081516020918201929091019080838360005b838110156100af578181015183820152602001610097565b50505050905090810190601f1680156100dc5780820380516001836020036101000a031916815260200191505b5060408181526020928301516352d1902d60e01b835290519094506001600160a01b03851693506352d1902d92600480840193919291829003018186803b15801561012657600080fd5b505afa15801561013a573d6000803e3d6000fd5b505050506040513d602081101561015057600080fd5b50517f027b9570e9fedc1a80b937ae9a06861e5faef3992491af30b684a64b3fbec7a5146101af5760405162461bcd60e51b815260040180806020018281038252602581526020018061039c6025913960400191505060405180910390fd5b807f360894a13ba1a3210667c828492db98dca3e2076cc3735a920a3ca505d382bbc5560006060826001600160a01b0316846040518082805190602001908083835b602083106102105780518252601f1990920191602091820191016101f1565b6001836020036101000a038019825116818451168082178552505050505050905001915050600060405180830381855af49150503d8060008114610270576040519150601f19603f3d011682016040523d82523d6000602084013e610275565b606091505b50915091508181906103055760405162461bcd60e51b81526004018080602001828103825283818151815260200191508051906020019080838360005b838110156102ca5781810151838201526020016102b2565b50505050905090810190601f1680156102f75780820380516001836020036101000a031916815260200191505b509250505060405180910390fd5b50505050506084806103186000396000f3fe60806040527f360894a13ba1a3210667c828492db98dca3e2076cc3735a920a3ca505d382bbc543660008037600080366000846127105a03f43d806000803e818015604957816000f35b816000fdfea2646970667358221220035d9150e603eadf995e60b49905802a6b32406f49081b8d18aafb5e8cc622f364736f6c634300060c0033636f6e7374727563746f723a205f7661756c744c6962206e6f7420636f6d70617469626c654f6e6c79207468652063757272656e742046756e644465706c6f7965722063616e2063616c6c20746869732066756e6374696f6e7369676e616c4d6967726174696f6e3a204e6f6e2d636f6e7472616374205f6e6578745661756c744163636573736f7273657443757272656e7446756e644465706c6f7965723a205f6e65787446756e644465706c6f79657220697320616c72656164792063757272656e7446756e644465706c6f79657263616e63656c4d6967726174696f6e3a204e6f206d6967726174696f6e20726571756573742065786973747373657443757272656e7446756e644465706c6f7965723a205f6e65787446756e644465706c6f7965722063616e6e6f7420626520656d70747963616e63656c4d6967726174696f6e3a204e6f7420616e20616c6c6f7765642063616c6c6572657865637574654d6967726174696f6e3a20546865207461726765742046756e644465706c6f796572206973206e6f206c6f6e676572207468652063757272656e742046756e644465706c6f7965724f6e6c792074686520636f6e7472616374206f776e65722063616e2063616c6c20746869732066756e6374696f6e72656d6f76654e6f6d696e617465644f776e65723a205468657265206973206e6f206e6f6d696e61746564206f776e65726465706c6f795661756c7450726f78793a204e6f6e2d636f6e7472616374205f7661756c744163636573736f727365744e6f6d696e617465644f776e65723a205f6e6578744e6f6d696e617465644f776e65722063616e6e6f7420626520656d7074797369676e616c4d6967726174696f6e3a205f7661756c7450726f787920646f6573206e6f74206578697374657865637574654d6967726174696f6e3a20546865206d6967726174696f6e2074696d656c6f636b20686173206e6f7420656c61707365647365744e6f6d696e617465644f776e65723a205f6e6578744e6f6d696e617465644f776e657220697320616c726561647920746865206f776e6572657865637574654d6967726174696f6e3a204f6e6c7920746865207461726765742046756e644465706c6f7965722063616e2063616c6c20746869732066756e6374696f6e7365744e6f6d696e617465644f776e65723a205f6e6578744e6f6d696e617465644f776e657220697320616c7265616479206e6f6d696e61746564636c61696d4f776e6572736869703a204f6e6c7920746865206e6f6d696e617465644f776e65722063616e2063616c6c20746869732066756e6374696f6e7369676e616c4d6967726174696f6e3a2043616e206f6e6c79206d69677261746520746f2061206e65772046756e644465706c6f79657273657443757272656e7446756e644465706c6f7965723a204e6f6e2d636f6e7472616374205f6e65787446756e644465706c6f796572657865637574654d6967726174696f6e3a204e6f206d6967726174696f6e20726571756573742065786973747320666f72205f7661756c7450726f78797365744d6967726174696f6e54696d656c6f636b3a205f6e65787454696d656c6f636b206973207468652063757272656e742074696d656c6f636ba2646970667358221220e21c90a1f1002e4e4a2969ff7beae142a0f9346224f2331772a357b8e2bbcaab64736f6c634300060c0033",
  "devdoc": {
    "details": "DO NOT EDIT CONTRACT",
    "kind": "dev",
    "methods": {
      "cancelMigration(address,bool)": {
        "details": "Because this function must also be callable by a permissioned migrator, it has an extra migration hook to the nextFundDeployer for the case where cancelMigration() is called directly (rather than via the nextFundDeployer).",
        "params": {
          "_bypassFailure": "True if a failure in either migration hook should be ignored",
          "_vaultProxy": "The VaultProxy contract for which to cancel the migration request"
        }
      },
      "deployVaultProxy(address,address,address,string)": {
        "details": "Input validation should be handled by the VaultProxy during deployment",
        "params": {
          "_fundName": "The name of the fund",
          "_owner": "The account to set as the VaultProxy's owner",
          "_vaultAccessor": "The account to set as the VaultProxy's permissioned accessor",
          "_vaultLib": "The VaultLib library with which to instantiate the VaultProxy"
        }
      },
      "executeMigration(address,bool)": {
        "params": {
          "_bypassFailure": "True if a failure in either migration hook should be ignored",
          "_vaultProxy": "The VaultProxy contract for which to execute the migration request"
        }
      },
      "getCurrentFundDeployer()": {
        "returns": {
          "currentFundDeployer_": "The current FundDeployer contract address"
        }
      },
      "getFundDeployerForVaultProxy(address)": {
        "params": {
          "_vaultProxy": "The VaultProxy instance"
        },
        "returns": {
          "fundDeployer_": "The FundDeployer contract address"
        }
      },
      "getMigrationRequestDetailsForVaultProxy(address)": {
        "params": {
          "_vaultProxy": "The VaultProxy instance"
        },
        "returns": {
          "executableTimestamp_": "The timestamp at which the migration request can be executed",
          "nextFundDeployer_": "The FundDeployer contract address from which the migration request was made",
          "nextVaultAccessor_": "The account that will be the next `accessor` on the VaultProxy",
          "nextVaultLib_": "The next VaultLib library contract address to set on the VaultProxy"
        }
      },
      "getMigrationTimelock()": {
        "returns": {
          "migrationTimelock_": "The timelock value (in seconds)"
        }
      },
      "getNominatedOwner()": {
        "returns": {
          "nominatedOwner_": "The account that is nominated to be the owner"
        }
      },
      "getOwner()": {
        "returns": {
          "owner_": "The account that is the owner"
        }
      },
      "getSharesTokenSymbol()": {
        "returns": {
          "sharesTokenSymbol_": "The `symbol` value"
        }
      },
      "getTimelockRemainingForMigrationRequest(address)": {
        "params": {
          "_vaultProxy": "The VaultProxy instance"
        },
        "returns": {
          "secondsRemaining_": "The number of seconds remaining on the timelock"
        }
      },
      "hasExecutableMigrationRequest(address)": {
        "params": {
          "_vaultProxy": "The VaultProxy instance"
        },
        "returns": {
          "hasExecutableRequest_": "True if a migration request exists and is executable"
        }
      },
      "hasMigrationRequest(address)": {
        "params": {
          "_vaultProxy": "The VaultProxy instance"
        },
        "returns": {
          "hasMigrationRequest_": "True if a migration request exists"
        }
      },
      "setCurrentFundDeployer(address)": {
        "params": {
          "_nextFundDeployer": "The address of the FundDeployer contract"
        }
      },
      "setMigrationTimelock(uint256)": {
        "params": {
          "_nextTimelock": "The number of seconds for the new timelock"
        }
      },
      "setNominatedOwner(address)": {
        "details": "Does not prohibit overwriting the current nominatedOwner",
        "params": {
          "_nextNominatedOwner": "The account to nominate"
        }
      },
      "setSharesTokenSymbol(string)": {
        "params": {
          "_nextSymbol": "The symbol value to set"
        }
      },
      "signalMigration(address,address,address,bool)": {
        "params": {
          "_bypassFailure": "True if a failure in either migration hook should be ignored",
          "_nextVaultAccessor": "The account that will be the next `accessor` on the VaultProxy",
          "_nextVaultLib": "The next VaultLib library contract address to set on the VaultProxy",
          "_vaultProxy": "The VaultProxy contract for which to signal migration"
        }
      }
    },
    "title": "Dispatcher Contract",
    "version": 1
  },
  "userdoc": {
    "kind": "user",
    "methods": {
      "cancelMigration(address,bool)": {
        "notice": "Cancels a pending migration request"
      },
      "claimOwnership()": {
        "notice": "Claim ownership of the contract"
      },
      "deployVaultProxy(address,address,address,string)": {
        "notice": "Deploys a VaultProxy"
      },
      "executeMigration(address,bool)": {
        "notice": "Executes a pending migration request"
      },
      "getCurrentFundDeployer()": {
        "notice": "Gets the current FundDeployer that is allowed to deploy and migrate funds"
      },
      "getFundDeployerForVaultProxy(address)": {
        "notice": "Gets the FundDeployer with which a given VaultProxy is associated"
      },
      "getMigrationRequestDetailsForVaultProxy(address)": {
        "notice": "Gets the details of a pending migration request for a given VaultProxy"
      },
      "getMigrationTimelock()": {
        "notice": "Gets the amount of time that must pass between signaling and executing a migration"
      },
      "getNominatedOwner()": {
        "notice": "Gets the account that is nominated to be the next owner of this contract"
      },
      "getOwner()": {
        "notice": "Gets the owner of this contract"
      },
      "getSharesTokenSymbol()": {
        "notice": "Gets the shares token `symbol` value for use in VaultProxy instances"
      },
      "getTimelockRemainingForMigrationRequest(address)": {
        "notice": "Gets the time remaining until the migration request of a given VaultProxy can be executed"
      },
      "hasExecutableMigrationRequest(address)": {
        "notice": "Checks whether a migration request that is executable exists for a given VaultProxy"
      },
      "hasMigrationRequest(address)": {
        "notice": "Checks whether a migration request exists for a given VaultProxy"
      },
      "removeNominatedOwner()": {
        "notice": "Revoke the nomination of a new contract owner"
      },
      "setCurrentFundDeployer(address)": {
        "notice": "Set a new FundDeployer for use within the contract"
      },
      "setMigrationTimelock(uint256)": {
        "notice": "Sets a new migration timelock"
      },
      "setNominatedOwner(address)": {
        "notice": "Nominate a new contract owner"
      },
      "setSharesTokenSymbol(string)": {
        "notice": "Sets a new `symbol` value for VaultProxy instances"
      },
      "signalMigration(address,address,address,bool)": {
        "notice": "Signals a migration by creating a migration request"
      }
    },
    "notice": "The top-level contract linking multiple releases. It handles the deployment of new VaultProxy instances, and the regulation of fund migration from a previous release to the current one. It can also be referred to for access-control based on this contract's owner.",
    "version": 1
  },
  "storageLayout": {
    "storage": [
      {
        "astId": 7007,
        "contract": "contracts/persistent/dispatcher/Dispatcher.sol:Dispatcher",
        "label": "currentFundDeployer",
        "offset": 0,
        "slot": "0",
        "type": "t_address"
      },
      {
        "astId": 7009,
        "contract": "contracts/persistent/dispatcher/Dispatcher.sol:Dispatcher",
        "label": "nominatedOwner",
        "offset": 0,
        "slot": "1",
        "type": "t_address"
      },
      {
        "astId": 7011,
        "contract": "contracts/persistent/dispatcher/Dispatcher.sol:Dispatcher",
        "label": "owner",
        "offset": 0,
        "slot": "2",
        "type": "t_address"
      },
      {
        "astId": 7013,
        "contract": "contracts/persistent/dispatcher/Dispatcher.sol:Dispatcher",
        "label": "migrationTimelock",
        "offset": 0,
        "slot": "3",
        "type": "t_uint256"
      },
      {
        "astId": 7015,
        "contract": "contracts/persistent/dispatcher/Dispatcher.sol:Dispatcher",
        "label": "sharesTokenSymbol",
        "offset": 0,
        "slot": "4",
        "type": "t_string_storage"
      },
      {
        "astId": 7019,
        "contract": "contracts/persistent/dispatcher/Dispatcher.sol:Dispatcher",
        "label": "vaultProxyToFundDeployer",
        "offset": 0,
        "slot": "5",
        "type": "t_mapping(t_address,t_address)"
      },
      {
        "astId": 7023,
        "contract": "contracts/persistent/dispatcher/Dispatcher.sol:Dispatcher",
        "label": "vaultProxyToMigrationRequest",
        "offset": 0,
        "slot": "6",
        "type": "t_mapping(t_address,t_struct(MigrationRequest)7005_storage)"
      }
    ],
    "types": {
      "t_address": {
        "encoding": "inplace",
        "label": "address",
        "numberOfBytes": "20"
      },
      "t_mapping(t_address,t_address)": {
        "encoding": "mapping",
        "key": "t_address",
        "label": "mapping(address => address)",
        "numberOfBytes": "32",
        "value": "t_address"
      },
      "t_mapping(t_address,t_struct(MigrationRequest)7005_storage)": {
        "encoding": "mapping",
        "key": "t_address",
        "label": "mapping(address => struct Dispatcher.MigrationRequest)",
        "numberOfBytes": "32",
        "value": "t_struct(MigrationRequest)7005_storage"
      },
      "t_string_storage": {
        "encoding": "bytes",
        "label": "string",
        "numberOfBytes": "32"
      },
      "t_struct(MigrationRequest)7005_storage": {
        "encoding": "inplace",
        "label": "struct Dispatcher.MigrationRequest",
        "members": [
          {
            "astId": 6998,
            "contract": "contracts/persistent/dispatcher/Dispatcher.sol:Dispatcher",
            "label": "nextFundDeployer",
            "offset": 0,
            "slot": "0",
            "type": "t_address"
          },
          {
            "astId": 7000,
            "contract": "contracts/persistent/dispatcher/Dispatcher.sol:Dispatcher",
            "label": "nextVaultAccessor",
            "offset": 0,
            "slot": "1",
            "type": "t_address"
          },
          {
            "astId": 7002,
            "contract": "contracts/persistent/dispatcher/Dispatcher.sol:Dispatcher",
            "label": "nextVaultLib",
            "offset": 0,
            "slot": "2",
            "type": "t_address"
          },
          {
            "astId": 7004,
            "contract": "contracts/persistent/dispatcher/Dispatcher.sol:Dispatcher",
            "label": "executableTimestamp",
            "offset": 0,
            "slot": "3",
            "type": "t_uint256"
          }
        ],
        "numberOfBytes": "128"
      },
      "t_uint256": {
        "encoding": "inplace",
        "label": "uint256",
        "numberOfBytes": "32"
      }
    }
  }
}